original,translation,
"Woe to me that my wretched life and poor choices has landed me, Caspar of Loral, on this barren rock as the keeper of lights","Ay de mi, que mi miserable vida y mis malas decisiones me han llevado, a mi, Gaspar de Loral, a esta roca esteril como guardian de las luces.",
About six months ago,Hace unos seis meses,
Saw lights on the shore near the cave entrance,Vi luces en la orilla cerca de la entrada de la cueva,
Smugglers Mathias say,Los contrabandistas dicen Mathias,
"He insists we leave them alone and I am forced to abide, though my mind wanders often to that cave and what may lay within","El insiste en que los dejemos en paz y me veo obligado a aceptarlo, aunque mi mente a menudo divaga hacia esa cueva y lo que puede haber dentro.",
About a month ago,Hace aproximadamente un mes,
I cannot take it any more!,¡No lo soporto mas!,
The old bastard is driving me mad!,¡El viejo bastardo me esta volviendo loco!,
He spies on me and gives me strange looks,El me espia y me mira raro,
And I’m sure he goes through my things!,¡Y estoy segura que revisa mis cosas!,
I went for a walk to clear my head and I ended up by the entrance to the sea-cave,Sali a caminar para despejarme y termine en la entrada de la cueva marina.,
Something is calling me there,Algo me esta llamando alli,
I hear it even in my sleep,Lo oigo incluso mientras duermo.,
About a week before your arrival in Idra,Aproximadamente una semana antes de su llegada a Idra,
Dreams driving me mad!,¡Los sueños me vuelven loco!,
Always it calls me to the caves,Siempre me llama a las cuevas.,
To the deeper dark that lies beneath where no man has tread for eons,"A la oscuridad mas profunda que yace debajo, donde ningun hombre ha pisado durante eones.",
The looking stone and the ancient sleepers,La piedra que mira y los antiguos durmientes,
The blade calls me,La espada me llama,
I can take no more,No puedo aguantar mas,
Smuggler's Journal,Diario del contrabandista,
A small leather-bound book,Un pequeño libro encuadernado en cuero,
I hate these jobs,Odio estos trabajos,
Dropped off and told to guard the cargo until it can be collected,Lo dejaron y le dijeron que cuidara la carga hasta que pudiera ser recogida,
And whilst the bastards up in the northern cave are living the good life I’m stuck in this hole,"Y mientras los bastardos de la cueva del norte viven la buena vida, yo estoy atrapado en este agujero.",
I sometimes think the Imperial dungeons would be preferable,A veces pienso que las mazmorras imperiales serian preferibles,
We explored the cave today and found what appears to be an underwater tunnel in one of the dead-ends,Hoy exploramos la cueva y encontramos lo que parece ser un tunel submarino en uno de los callejones sin salida,
Bryn insisted we try to swim it but I can think of no worse nightmare than being lost in the dark underwater,"Bryn insistio en que intentaramos nadar hasta alli, pero no puedo pensar en una pesadilla peor que estar perdido en la oscuridad bajo el agua.",
I told him as much and he got agitated,Se lo dije y el se puso nervioso,
Yelled something about dreaming of an ancient relic,Grito algo sobre soñar con una reliquia antigua,
I have no idea what he’s on about,No tengo idea de que esta hablando,
Golden dead!,¡Muerto de oro!,
Bryn got attacked by a crab the size of a warhound today!,¡Bryn fue atacado hoy por un cangrejo del tamaño de un sabueso de guerra!,
Nearly took his leg off!,¡Casi le arranco la pierna!,
Neither of us have seen anything like it before and we can only pray it was alone!,Ninguno de nosotros habia visto algo asi antes y solo podemos rezar para que haya sido en soledad,
Hope the ship won't be delayed much longer,Esperemos que el barco no se retrase mucho mas,
Bryn is gone,Bryn se ha ido,
I know in my heart he’s gone to the underwater tunnel,Se en mi corazon que se ha ido al tunel submarino,
Madness!,¡Locura!,
Shapes are moving in the dark now,Ahora las formas se mueven en la oscuridad,
No way out and no one is coming for me!,¡No tengo salida y nadie viene a buscarme!,
Light is failing,La luz esta fallando,
Mother,Madre,
Marita's Cookbook,El libro de cocina de Marita,
A humble cookbook,Un humilde libro de cocina,
VEGETABLE SOUP,SOPA DE VERDURAS,
Potatoes - Carrots - Leeks,Patatas - Zanahorias - Puerros,
All of the above can be found growing in our field,Todo lo anterior se puede encontrar creciendo en nuestro campo,
FARMER'S OMELETTE,TORTILLA DE GRANJERO,
x Eggs - Potatoes - Onions,x Huevos - Patatas - Cebollas,
Sea bird eggs will do just fine,Los huevos de aves marinas estaran bien,
Onions grow wild in abundance,Las cebollas crecen silvestres en abundancia,
Cabal Journal,Revista de la Cabala,
A journal that appears to have been written by one of the members of the Cabal expedition,Un diario que parece haber sido escrito por uno de los miembros de la expedicion de la Cabala,
This one was found in the base-camp,Este fue encontrado en el campamento base,
ENTRY,ENTRADA,
We’ve finally arrived at the Priory and found it in shockingly good condition,Finalmente llegamos al Priorato y lo encontramos en sorprendentemente buenas condiciones,
It’s as if time has stood still here,Es como si el tiempo se hubiera detenido aqui,
The initial survey does not reveal a clear means of accessing the lower level but I’m confident we’ll find a way given enough time,"El estudio inicial no revela un medio claro para acceder al nivel inferior, pero confio en que encontraremos una manera si disponemos de suficiente tiempo.",
This place boggles the mind,Este lugar es alucinante,
It appears to stand as it was left millennia ago,Parece estar tal y como quedo hace milenios,
How it could have slipped so well out of time and history is truly a mystery to me,Como pudo haber escapado tan facilmente del tiempo y de la historia es realmente un misterio para mi,
As is the fate of the Priory’s original occupants,¿Como fue el destino de los ocupantes originales del Priorato?,
Still no success in finding the door to the catacombs,Aun no hay exito en encontrar la puerta de las catacumbas,
I can only conclude it’s somehow concealed,Solo puedo concluir que de alguna manera esta oculto,
"We did, however, make an interesting discovery","Sin embargo, hicimos un descubrimiento interesante.",
The four statues on the “pilgrim’s road” can be rotated,Las cuatro estatuas del “camino del peregrino” se pueden girar,
I’m certain this is somehow significant!,¡Estoy seguro de que esto es de algun modo significativo!,
Some form of disease is spreading amongst the men,Alguna forma de enfermedad se esta propagando entre los hombres,
Abdominal pain and swelling combined with fevers,Dolor e hinchazon abdominal combinados con fiebre,
Our apothecary is so far at a loss at curing it but suggests that proximity to the fungal growths that started sprouting is a potential vector of infection,"Nuestro boticario hasta ahora no ha podido curarlo, pero sugiere que la proximidad a los crecimientos de hongos que comenzaron a brotar es un vector potencial de infeccion.",
I’ve ordered that masks be worn near the growths,He ordenado que se usen mascarillas cerca de los crecimientos,
A breakthrough,Un gran avance,
We found a document in the scriptorium with a verse on it!,¡Encontramos un documento en el scriptorium con un versiculo!,
It’s so clear now,Esta tan claro ahora,
The portal had been hidden in plain sight all along - all it took to open it was the correct configuration of the statues!,El portal habia estado oculto a plena vista todo el tiempo: ¡todo lo que se necesito para abrirlo fue la configuracion correcta de las estatuas!,
The dreaming halls await!,¡Los salones de los sueños te esperan!,
A journal that appears to have been written by one of the members of the Cabal expedition that was dispatched to the Priory,Un diario que parece haber sido escrito por uno de los miembros de la expedicion de la Cabala que fue enviada al Priorato,
This one was found on a cocooned corpse in the catacombs,Este fue encontrado en un cadaver envuelto en un capullo en las catacumbas,
We entered the ‘Dreaming Hall’ today,Hoy entramos al 'Salon de los Sueños',
I’m awestruck by the mystery of it all,Estoy asombrado por el misterio de todo esto,
What secrets did the Sleeper whisper to the monks as they dreamed?,¿Que secretos susurro el Durmiente a los monjes mientras soñaban?,
We must push on and soon enough we too shall stand before his timeless glory,Debemos seguir adelante y pronto nosotros tambien estaremos ante su gloria eterna,
"By the Maiden’s, we found it!","¡Por la doncella, lo encontramos!",
The tomb in all its glory,La tumba en todo su esplendor,
We lost two members to traps trying to enter the room but it’s only a matter of time now,"Perdimos a dos miembros por trampas que intentaban ingresar a la habitacion, pero ahora es solo cuestion de tiempo.",
This is a disaster!,¡Esto es un desastre!,
I know there is something here - calling for us!,¡Se que hay algo aqui que nos llama!,
There must be some other way?,¿Debe haber alguna otra manera?,
Several pages are ruined from the fungal infection,Varias paginas estan arruinadas por la infeccion por hongos,
to move in and out of the caves and continue excavating the Eternity Gate,Entrar y salir de las cuevas y continuar excavando la Puerta de la Eternidad,
My greatest concern at this point is the rate at which we are losing crew to suicides and infection,Mi mayor preocupacion en este momento es la velocidad a la que estamos perdiendo tripulantes por suicidios e infecciones,
I saw them change before my very eyes!,¡Los vi cambiar ante mis propios ojos!,
"Oh, blessed Maidens I may have escaped for now but I cannot escape the images that now haunt me","Oh, benditas doncellas, puede que haya escapado por ahora, pero no puedo escapar de las imagenes que ahora me persiguen.",
"What’s worse, the entire complex is somehow resealing itself and I’m trapped between the false tomb and the surface level","Lo que es peor, todo el complejo de alguna manera se esta volviendo a sellar y estoy atrapado entre la falsa tumba y el nivel de la superficie.",
I can only pray someone is left alive topside to open the gate,Solo puedo rezar para que quede alguien con vida arriba para abrir la puerta,
This one was found on a corpse in the catacombs,Este fue encontrado en un cadaver en las catacumbas,
They’ve found the secret passage to some kind of cave below the false tomb,Han encontrado el pasaje secreto a una especie de cueva debajo de la falsa tumba,
Something far older than the Priory itself,Algo mucho mas antiguo que el propio Priorato,
Older than the Empire even is the talk around camp,"Mas antiguo que el Imperio, incluso, es el rumor en el campamento.",
I just wish my insides didn’t hurt as much,Solo deseo que mis entrañas no me duelan tanto,
They’re sending me down with the next shipment of tools,Me enviaran con el proximo envio de herramientas,
That means passing the ‘night-maze’,Eso significa pasar por el 'laberinto nocturno',
They say it can’t be lit even by magical lighting,Dicen que no se puede iluminar ni siquiera con luz magica,
I hate the dark,Odio la oscuridad,
Apparently it’s easy enough to navigate if you know how,Aparentemente es bastante facil navegar si sabes como,
South until you hit the first wall and then west until wall - north until wall - west until wall - north until wall - west until wall - then north and you’re there,Sur hasta llegar a la primera pared y luego oeste hasta la pared - norte hasta la pared - oeste hasta la pared - norte hasta la pared - oeste hasta la pared - luego norte y ya estas ahi,
I went all the way to the sanctum this time,Esta vez fui hasta el santuario,
By the Golden how I wish I had not,"Por el Oro, como desearia no haberlo hecho.",
How can such a thing be?,¿Como puede ser tal cosa?,
The writing becomes rushed,La escritura se vuelve apresurada,
Hear screams below,Escucha gritos abajo,
Something is wrong,Algo esta mal,
Save us!,¡Salvanos!,
#Clothing,#Ropa,
Clothing,Ropa,
Apron,Delantal,
Dress,Vestido,
Commoner's Garb,Atuendo de plebeyo,
Rough but functional woolen clothing that serves the hard-working commoners of the empire well,Ropa de lana aspera pero funcional que sirve bien a los trabajadores plebeyos del imperio,
Bravo's Outfit,El atuendo de Bravo,
Checkered Tunic,Tunica a cuadros,
Doublet,Doblete,
Noble's Outfit,Atuendo de noble,
Pants,Pantalones,
Rags,Harapos,
Ranger's Outfit,Traje de guardabosques,
Robes,Tunicas,
Flashy Shirt,Camisa llamativa,
Short Pants,Pantalones cortos,
Comfortable Outfit,Atuendo comodo,
Tabard,Tabardo,
Toga,Toga,
Traveler's Garb,Atuendo de viajero,
Rough but functional woolen clothing,Ropa de lana aspera pero funcional,
Well suited for travel and adventuring if you can learn to live with the itching,Muy adecuado para viajes y aventuras si puedes aprender a vivir con la picazon.,
Tribal Sash,Faja tribal,
Furs,Pieles,
#Consumeables,#Consumibles,
Consume,Consumir,
Consumable,Consumible,
Brandy,brandy,
A bottle of strong Gorremian brandy,Una botella de brandy gorremiano fuerte,
The tired old mercenary's best friend,El mejor amigo del viejo mercenario cansado,
Potion of Cure Disease,Pocion de cura de enfermedades,
Potion of Cure Poison,Pocion para curar veneno,
Firgol Cider,Sidra Firgol,
"Sparkling and sweet, this cider comes from the slow-growing orchards of Firgol","Espumosa y dulce, esta sidra proviene de los huertos de crecimiento lento de Firgol.",
Many claim it’s the best in all of the Northern Empire whilst a handful of bad apples will complain it’s too sweet,"Muchos afirman que es el mejor de todo el Imperio del Norte, mientras que un puñado de personas podridas se quejaran de que es demasiado dulce.",
Potion of Greater Restoration,Pocion de mayor restauracion,
Greater Tonic of Vitality,Gran Tonico de Vitalidad,
Lesser Tonic of Vitality,Tonico menor de vitalidad,
Moderate Tonic of Vitality,Tonico moderado de vitalidad,
Potion of Acid Immunity,Pocion de inmunidad acida,
Potion of Electric Immunity,Pocion de inmunidad electrica,
Potion of Fire Immunity,Pocion de inmunidad al fuego,
Potion of Panic Immunity,Pocion de inmunidad al panico,
Greater Attunement Tonic,Tonico de mayor sintonia,
Lesser Attunement Tonic,Tonico de Sintonizacion Menor,
Moderate Attunement Tonic,Tonico de sintonizacion moderada,
Mead,Aguamiel,
A sweet alcoholic brew made from honey,Una bebida alcoholica dulce hecha con miel.,
Widely enjoyed in all of the Northern Empire and the Outer Isles,Ampliamente disfrutado en todo el Imperio del Norte y las Islas Exteriores.,
Potion of Agility,Pocion de agilidad,
Potion of Bless,Pocion de bendicion,
Potion of Diamond Form,Pocion de forma de diamante,
Potion of Fortify Will,Pocion de fortalecer la voluntad,
Potion of Frenzy,Pocion de frenesi,
Potion of Heroism,Pocion de heroismo,
Potion of Regeneration,Pocion de regeneracion,
Potion of Speed,Pocion de velocidad,
Potion of Stone Skin,Pocion de piel de piedra,
Potion of Strength,Pocion de fuerza,
Potion of Acid Resistance,Pocion de resistencia al acido,
Potion of Electric Resistance,Pocion de resistencia electrica,
Potion of Fire Resistance,Pocion de resistencia al fuego,
#Foods,#Alimentos,
Apple,Manzana,
"Whilst its ability to keep the medicae away has yet to be proven, this common fruit can be found growing on trees in the summer months and is a staple in the pantry of peasants and noblemen alike","Aunque su capacidad para mantener alejadas a las enfermedades aun no se ha demostrado, esta fruta comun crece en los arboles durante los meses de verano y es un alimento basico en la despensa de campesinos y nobles por igual.",
Bacon,Tocino,
There is truly no better way to start the day than with a fresh chunk of this salted pork,Realmente no hay mejor manera de empezar el dia que con un trozo fresco de esta carne de cerdo salada.,
Dark Bread,Pan oscuro,
A piece of the traditional dark and heavy full-grain bread that is eaten throughout the region by farmers and laborers,Un trozo del tradicional pan integral oscuro y pesado que comen en toda la region los agricultores y los trabajadores.,
Butter,Manteca,
"Due to its affordability, the rich and creamy, salted butter from Heartlander cows is a popular source of nourishment amongst the lower classes of the Empire","Debido a su asequibilidad, la mantequilla salada, rica y cremosa de las vacas Heartlander es una fuente popular de alimento entre las clases bajas del Imperio.",
There’s nothing butter,No hay nada de mantequilla,
Carrot,Zanahoria,
"Abundant and healthy, carrots are a staple in the soups and stews of the north","Abundantes y saludables, las zanahorias son un alimento basico en las sopas y guisos del norte.",
"Also, Hospitallers claim they improve your night-sight","Ademas, los Hospitalarios afirman que mejoran la vision nocturna.",
Cheddar,queso Cheddar,
"Made from cow's milk, this cheese is common and beloved throughout the Imperial heartlands","Hecho con leche de vaca, este queso es comun y querido en todo el corazon del Imperio.",
Perfect for eating with bread and ham,Perfecto para comer con pan y jamon.,
Sheep's Milk Cheese,Queso de leche de oveja,
As inexpensive and filling as it is smelly,Tan economico y abundante como oloroso.,
Sheep's milk cheese is a staple in the northern Hinterlands,El queso de leche de oveja es un alimento basico en las Tierras Interiores del Norte.,
Crab,Cangrejo,
"Many of the Empire’s citizens will pay a pretty penny to get their hands on this soft, sweet meat",Muchos de los ciudadanos del Imperio pagarian un dineral para tener en sus manos esta carne suave y dulce.,
"Boiled in salted water and served on white bread with melted butter and squeezed lemon, crab-meat is truly a feast","Hervida en agua salada y servida en pan blanco con mantequilla derretida y limon exprimido, la carne de cangrejo es un verdadero festin.",
Cream,Crema,
Rich and creamy,Rico y cremoso,
Don’t let the cat have it,No dejes que el gato lo tenga,
Dried Meat,Carne seca,
"A favorite amongst adventures, this smoky, preserved meat can last longer than most people’s lives","Una de las favoritas entre los aventureros, esta carne ahumada y conservada puede durar mas que la vida de la mayoria de las personas.",
Eel,Anguila,
"Due to their abundance in both rivers and oceans, eels are one of the most popular seafoods in the Empire","Debido a su abundancia tanto en rios como en oceanos, las anguilas son uno de los mariscos mas populares del Imperio.",
"So popular, in fact, that some citizens have even been known to accept them as payment","Tan populares, de hecho, que algunos ciudadanos incluso los aceptan como forma de pago.",
Eggs,Huevos,
Don't put them all in one basket,No los pongas a todos en una sola canasta,
Perklin,Perklin,
The humble perklin makes up for its meager size with its abundance,El humilde perklin compensa su escaso tamaño con su abundancia.,
It's often perserved with salt and eaten year round,A menudo se conserva con sal y se come durante todo el año.,
The smell is an acquired taste,El olor es un gusto adquirido.,
Redman,Hombre rojo,
The tongue and eyes of the redman swells grotesquely once it's pulled from the depth in which it dwells,La lengua y los ojos del hombre rojo se hinchan grotescamente cuando son sacados de la profundidad en la que habitan.,
"Despite its apperance, however, its flesh is considered a delicacy when served baked with lemons and vegetables","Sin embargo, a pesar de su apariencia, su pulpa se considera un manjar cuando se sirve horneada con limones y verduras.",
Steel-Fin,Aleta de acero,
Dead fish eyes stare up at you,Los ojos de los peces muertos te miran fijamente,
Steel-Fin is a staple on dinner tables throughout the Outer Isles,Steel-Fin es un alimento basico en las mesas de las Islas Exteriores.,
It's commonly eaten in hearthy stews with vegetables,Se come comunmente en guisos abundantes con verduras.,
Flour,Harina,
One of the greatest of the Gallian Miracles was the turning of deserts into the great rolling wheat fields that now constitute a large portion of the Heartland,Uno de los mayores milagros galos fue la transformacion de los desiertos en los grandes campos de trigo que hoy constituyen una gran parte del corazon de Inglaterra.,
From these flows countless tons of grain and rich white flour,De aqui fluyen innumerables toneladas de grano y rica harina blanca.,
Garlic,Ajo,
"Pungent and full of flavor, this herb is most frequently used to enhance a variety of meals","Picante y llena de sabor, esta hierba se utiliza con mayor frecuencia para realzar una variedad de comidas.",
Cured Ham,Jamon curado,
"Tender, savory and long lasting","Tierno, sabroso y duradero.",
Cured ham is found in the cellar of every well-to-do merchant and petty noble in the Empire,El jamon curado se encuentra en la bodega de cada comerciante adinerado y pequeño noble del Imperio.,
Honey,Miel,
"Sticky and sweet, this ingredient is often used by cooks to sweeten or preserve food, and is a staple in every mead-makers arsenal","Pegajoso y dulce, este ingrediente es utilizado a menudo por los cocineros para endulzar o conservar los alimentos, y es un elemento basico en el arsenal de todo fabricante de hidromiel.",
It is even said to have curative properties when applied to infected wounds,Incluso se dice que tiene propiedades curativas cuando se aplica a heridas infectadas.,
Leeks,Puerros,
"Beyond just the taste, leeks go a long way towards adding some color to the drab cuisine of the poor","Mas alla del sabor, los puerros contribuyen en gran medida a agregar algo de color a la cocina monotona de los pobres.",
Lemons,Limones,
"In the north, lemons are almost exclusively found on ships where they serve to protect the sailors from the terrible scurvy that prolonged idleness and sexual abstinence is known to cause","En el norte, los limones se encuentran casi exclusivamente en los barcos, donde sirven para proteger a los marineros del terrible escorbuto que se sabe que causa la ociosidad prolongada y la abstinencia sexual.",
Baked Crab,Cangrejo al horno,
The crab flesh is coated in spiced butter before baking in the oven to perfection,La carne de cangrejo se cubre con mantequilla especiada antes de hornearla en el horno a la perfeccion.,
Baked Mushrooms,Champiñones al horno,
The nutty flavor of the wyrdloaf mixes wonderfully with the aromas of garlic to produce a meal fit for an emperor,El sabor a nuez del pan Wyrd se mezcla maravillosamente con los aromas del ajo para producir una comida digna de un emperador.,
Baked Onions,Cebollas al horno,
"Onions are easily grow, keep for long and go a long ways towards covering up the taste of half-spoiled fish or meat","Las cebollas son faciles de cultivar, se conservan durante mucho tiempo y son muy utiles para disimular el sabor del pescado o la carne medio en mal estado.",
Baked Oysters,Ostras al horno,
Tender oysters coated in bread-crumbs and baked until just right,Ostras tiernas rebozadas en pan rallado y horneadas hasta su punto justo.,
You just hope the oysters were fresh,Solo espero que las ostras esten frescas.,
Baked Potato,Patata al horno,
It is said that potatoes alone can nourish a man's body indefinitely,Se dice que las patatas por si solas pueden nutrir el cuerpo de un hombre indefinidamente.,
The same cannot be said for his soul,Lo mismo no puede decirse de su alma.,
Beef Stew,Estofado de carne,
"A thick, hearty stew of beef cooked in rich, Ombarian wine",Un guiso espeso y abundante de carne de res cocinada en rico vino ombariano.,
Cheese Plate,Plato de quesos,
"Ah, the understated elegance of a cheese and fruit plate","Ah, la discreta elegancia de un plato de quesos y frutas.",
Eggs and Bacon,Huevos y tocino,
The breakfast of titans,El desayuno de los titanes,
Baked Fish,Pescado al horno,
"A delicious-looking plate of baked, white fish on a bed of vegetables seasoned with freshly squeezed lemon",Un plato de aspecto delicioso de pescado blanco al horno sobre un lecho de verduras aderezado con limon recien exprimido.,
Salted Fish,Pescado salado,
The fisherman's best friend,El mejor amigo del pescador,
Preferably eaten with a mug of ale on the side,Preferiblemente se come con una jarra de cerveza al lado.,
Fish Stew,Estofado de pescado,
A steaming bowl of fish and vegetable stew,Un plato humeante de guiso de pescado y verduras,
This type of dish is eaten more or less daily by the coast-dwellers of the north,Este tipo de plato se consume mas o menos a diario por los habitantes de la costa del norte.,
It could do with some salt,Podria venirle bien un poco de sal,
Grilled Leeks,Puerros a la parrilla,
Mashed Potatoes,Pure de papas,
Just the way mothers all over the Empire would make it!,¡Justo como lo harian las madres de todo el Imperio!,
Meat Skewers,Brochetas de carne,
Richly spiced meat roasted on skewers,Carne ricamente especiada asada en brochetas,
A popular dish that the Empire imported from its overseas colonies,Un plato popular que el Imperio importo de sus colonias de ultramar.,
Farmer's Omelette,Tortilla de granjero,
"A nice farmer's omelette brings to mind the simple comforts of a quaint, rural life",Una buena tortilla campesina evoca las sencillas comodidades de una vida rural pintoresca.,
Mushroom Omelette,Tortilla de champiñones,
The mushroom omelette tastes of the forest,La tortilla de champiñones sabe a bosque,
Apple Pie,Tarta de manzana,
Sweet and comforting,Dulce y reconfortante,
Pumpkin Pie,Pastel de calabaza,
Nothing says autumn like a nice old slice of pumpkin pie,Nada representa el otoño como una buena rebanada de pastel de calabaza.,
Roasted Eel,Anguila asada,
