original,translation,
"Easily recognizable with its red cap and white spots, the Laughtercap is not to be ingested as it is said to cause hysterical laughter and odd visions","Facilmente reconocible por su sombrero rojo y manchas blancas, el Laughtercap no debe ingerirse ya que se dice que causa risa histerica y visiones extrañas.",
Many an apprentice alchemist has ignored this warning through the ages,Muchos aprendices de alquimistas han ignorado esta advertencia a lo largo de los siglos.,
Protoplasma,Protoplasma,
"Whilst this jelly-like substance may look harmless, its properties have been known to create potions just as acidic as the creature it comes from","Aunque esta sustancia gelatinosa puede parecer inofensiva, se sabe que sus propiedades crean pociones tan acidas como la criatura de la que proviene.",
"Do not, under any circumstances, ingest",No ingerir bajo ninguna circunstancia.,
Rat Tail,Cola de rata,
Rats are so ubiquitously despised throughout the Empire that certain merchants will pay a bounty for their tails,Las ratas son tan despreciadas en todo el Imperio que ciertos comerciantes pagan una recompensa por sus colas.,
As will certain alchemists,Como lo haran ciertos alquimistas,
Rotcrawler (insect,Rotcrawler (insecto),
"Whilst most citizens of the Empire would be disgusted by its presence, this larva-like insect can be useful to those who know what to do with it","Aunque la mayoria de los ciudadanos del Imperio estarian disgustados por su presencia, este insecto con forma de larva puede ser util para aquellos que saben que hacer con el.",
Rotmold,Moho de putrefaccion,
"An aggressive mold known to eat almost any organic material it comes into contact with, this mold has cost more than a few citizens their cheese cellars","Un moho agresivo que se sabe que devora casi cualquier material organico con el que entra en contacto, este moho ha costado a mas de unos pocos ciudadanos sus bodegas de queso.",
And pets,Y mascotas,
Scale,Escala,
"This rare, luminescent scale was likely taken from some sort of giant lizard or sea creature",Esta rara y luminiscente escama probablemente fue tomada de algun tipo de lagarto gigante o criatura marina.,
"Whilst it is primarily used as an alchemical ingredient, its beauty makes it a popular ingredient amongst artisans on the Outer Isles","Aunque se utiliza principalmente como ingrediente alquimico, su belleza lo convierte en un ingrediente popular entre los artesanos de las Islas Exteriores.",
Typically given as a gift to those in grief,Generalmente se da como regalo a quienes estan de duelo.,
"It is said that if the plant is placed near your bed it will gorge on your despair, offering some slight respite","Se dice que si la planta se coloca cerca de tu cama, se alimentara de tu desesperacion, ofreciendote un ligero respiro.",
Spider Silk,Seda de araña,
"Though it may be light in weight, it is not light in use","Aunque puede ser ligero en peso, no es ligero en uso.",
This silky ingredient has been used in a variety of potion recipes for centuries and is popular amongst the Empire’s finest alchemists,Este ingrediente sedoso se ha utilizado en una variedad de recetas de pociones durante siglos y es popular entre los mejores alquimistas del Imperio.,
"Unfortunately, the same cannot be said for the creature that spins it","Desafortunadamente, no se puede decir lo mismo de la criatura que lo hace girar.",
"Named due to an old wives’ tale in which flowers began to grow at the site of a fallen star, this white plant is often given between lovers as a sign of affection","Esta planta blanca, que recibe su nombre debido a un cuento de viejas en el que comenzaron a crecer flores en el lugar de una estrella caida, a menudo se regala entre amantes como muestra de afecto.",
Sulfur,Azufre,
"Sometimes called the Heart of Life by alchemists across the Empire, this element is known to be extremely flammable yet alchemically potent","A veces llamado el Corazon de la Vida por los alquimistas de todo el Imperio, este elemento es conocido por ser extremadamente inflamable pero alquimicamente potente.",
Caution is advised,Se recomienda precaucion,
"Often found growing in areas of direct sunlight, these bright flowers are often used as decoration during the summer solstice","Estas flores brillantes, que a menudo crecen en areas con luz solar directa, se utilizan a menudo como decoracion durante el solsticio de verano.",
Tusk,Colmillo,
A huge tusk pried from the jaws of a monstrous hog,Un colmillo enorme arrancado de las fauces de un cerdo monstruoso,
"For those who are brave or foolish enough to hunt such creatures, this useful alchemical ingredient makes a fine prize","Para aquellos que son lo suficientemente valientes o tontos como para cazar a estas criaturas, este util ingrediente alquimico es un buen premio.",
Venom Gland,Glandula del veneno,
A rather foul smelling sack removed from some kind of venomous animal,Un saco con un olor bastante desagradable extraido de algun tipo de animal venenoso.,
The liquid inside does not look much better than it smells,El liquido en el interior no se ve mucho mejor de lo que huele.,
Do not ingest,No ingerir,
Withered Hand,Mano marchita,
"Judging by the rotten scent emitting from this shriveled hand, it was likely cut from the wrist of a freshly risen ghoul","A juzgar por el olor a podrido que emitia esta mano arrugada, probablemente fue cortada de la muñeca de un ghoul recien resucitado.",
"Though desecration of the dead is taboo in Imperial society, the many uses for a ghoul’s flesh nonetheless causes it to fetch a hefty price on the black markets","Aunque la profanacion de los muertos es un tabu en la sociedad imperial, los muchos usos que se le dan a la carne de un ghoul hacen que alcance un precio elevado en los mercados negros.",
Fellbell,Fellbell,
"Fellbells emit a soft, mesmerizing chime that seems to attract mushroom-pickers and animals alike",Las campanillas emiten un sonido suave y fascinante que parece atraer tanto a los recolectores de setas como a los animales.,
Unfortunately it is also highly poisonous,Desafortunadamente tambien es muy venenoso.,
#Shields,#Escudos,
Buckler,Escudo,
A small rounded shield to be worn on the forearm,Un pequeño escudo redondeado para llevar en el antebrazo.,
Large Shield,Escudo grande,
A large shield,Un gran escudo,
Plank Shield,Escudo de tablones,
An improvised shield made from wooden planks,Un escudo improvisado hecho con tablones de madera.,
Tower Shield,Escudo de la torre,
Shield,Blindaje,
A medium sized shield,Un escudo de tamaño mediano,
Round Shield,Escudo redondo,
#Trinkets,#Baratijas,
Bone Comb,Peine de hueso,
"Finely carved from whale-bone, these combs provide a small modicum of luxury to the women and long-haired men of the Outer Isles","Finamente tallados en hueso de ballena, estos peines brindan un pequeño toque de lujo a las mujeres y los hombres de pelo largo de las Islas Exteriores.",
Buttons,Botones,
A small collection of mismatched buttons,Una pequeña coleccion de botones desparejados,
Conch Shell,Concha de caracol,
You can hear the sea in them,Se puede escuchar el mar en ellos.,
Cracked Wine Jug,Jarra de vino agrietada,
A clay vessel commonly used to hold wine,Un recipiente de barro comunmente utilizado para contener vino.,
It does its job poorly,Hace mal su trabajo,
Drinking Horn,Cuerno para beber,
A vessel used by locals from which wine or ale is drunk,Un recipiente utilizado por los lugareños para beber vino o cerveza.,
Embalming Tool,Herramienta de embalsamamiento,
A tool used by followers of the Imperial faith to prepare the dead for burial,Una herramienta utilizada por los seguidores de la fe imperial para preparar a los muertos para el entierro.,
Fishing Hook,Anzuelo de pesca,
A small metal hook used by locals to catch a variety of fish,Un pequeño anzuelo de metal utilizado por los lugareños para capturar una variedad de peces.,
Flute,Flauta,
A small bone or wood instrument,Un pequeño instrumento de hueso o madera.,
Fork,Tenedor,
A two pronged fork,Un tenedor de dos puntas,
"Though a good knife and fingers will suffice for most of the Empire's citizens, it simply will not do for a small select elite","Aunque un buen cuchillo y unos buenos dedos seran suficientes para la mayoria de los ciudadanos del Imperio, simplemente no serviran para una pequeña elite selecta.",
Glass Bead,Perlas de vidrio,
A spherical piece of glass sometimes used by islanders/locals to create jewelry or fool children,Una pieza esferica de vidrio que a veces utilizan los isleños y los lugareños para crear joyas o engañar a los niños.,
Goblet,Copa,
"A beaten up and ugly, albeit well crafted, tin goblet","Una copa de hojalata maltratada y fea, aunque bien elaborada.",
Ink Pot,Tintero,
A glass vessel half full of rich Ombarian ink,Un recipiente de vidrio medio lleno de rica tinta ombaria,
Mug,Taza,
A roughly made mug,Una taza toscamente hecha,
Likely used for the Empire's drink of choice,Probablemente utilizado como la bebida preferida del Imperio.,
Ale,Cerveza inglesa,
Old Shears,Tijeras viejas,
A cutting tool commonly used by local farmers to shear their meager flocks,Una herramienta de corte comunmente utilizada por los agricultores locales para esquilar sus escasos rebaños.,
Ornate Gamepiece,Pieza de juego adornada,
A piece from a set of pieces belonging to the game “Lancers,Una pieza de un conjunto de piezas pertenecientes al juego “Lancers,
Ornate Hand Mirror,Espejo de mano adornado,
"Commonly used by members of nobility to check their appearance, these handheld items are believed by some to be ‘mirrors to the soul’","Comunmente utilizados por miembros de la nobleza para verificar su apariencia, estos articulos portatiles son considerados por algunos como ""espejos del alma"".",
Parchment,Pergamino,
A stack of writing paper,Una pila de papel para escribir,
Pitcher,Lanzador,
A pitcher used for serving drinks,Una jarra utilizada para servir bebidas.,
Plate,Lamina,
A tin plate used for serving meals,Un plato de hojalata utilizado para servir comidas.,
Ream of Fine Cloth,Resma de tela fina,
Finely spun cloth is difficult to produce and highly coveted among the tailors of the Heartlands,La tela finamente hilada es dificil de producir y muy codiciada entre los sastres de las Tierras Centrales.,
Ream of Routhspun Cloth,Resma de tela hilada por el viento,
"Not as expensive as it's finer counterpart, but still a local commodity","No es tan caro como su contraparte mas fina, pero sigue siendo un producto local.",
Rusty Bread Knife,Cuchillo de pan oxidado,
A common household item often found in dining areas,Un articulo domestico comun que a menudo se encuentra en los comedores.,
Rusty Stick Pin,Alfiler de palo oxidado,
A brass pin sometimes used by commonfolk to hold various garments in place,Un alfiler de laton que a veces usaba la gente comun para sujetar diversas prendas en su lugar.,
Scrimshaw,Talla en marfil,
A small carving made from walrus teeth,Una pequeña talla hecha con dientes de morsa.,
Silk Ribbon,Cinta de seda,
Commonly used for braiding hair,Se utiliza comunmente para trenzar el cabello.,
Stained Glass Bottle,Botella de vidrio de colores,
An empty glass bottle that has taken on a green tint,Una botella de vidrio vacia que ha adquirido un tinte verde.,
Decorative Shell,Concha decorativa,
"The exoskeleton of various sea creatures, these shells are sometimes used by locals to create jewelry","El exoesqueleto de varias criaturas marinas, estas conchas a veces son utilizadas por los lugareños para crear joyas.",
Wooden Doll,Muñeca de madera,
"A toy made from smooth yew, these doll’s are popular gifts given to local children","Un juguete hecho de tejo liso, estas muñecas son regalos populares que se dan a los niños locales.",
Weaving Comb,Peine para tejer,
A tool commonly used in the weaving of tapestries,Una herramienta comunmente utilizada en el tejido de tapices.,
This one appears to be made from the wood of the Yew Trees often found in the Outer Isles,Este parece estar hecho de la madera de los arboles de tejo que se encuentran a menudo en las Islas Exteriores.,
Worn Dice,Dados desgastados,
The bane of fools everywhere,La pesadilla de los tontos en todas partes,
You wonder how many fortunes have fallen prey to its faded numbers,¿Te preguntas cuantas fortunas han caido victimas de sus numeros descoloridos?,
Writing Quill,Pluma para escribir,
A popular writing tool made from the feather of a large bird,Una herramienta de escritura popular hecha con la pluma de un pajaro grande.,
This one appears to need sharpening,Este parece necesitar afilarse,
Yarn,Hilo,
A yarn of wool spun from the shag of the sturdy breed of goats that roam the hills in the Outer Isles,Un hilo de lana hilado a partir de la pelusa de la robusta raza de cabras que vagan por las colinas de las Islas Exteriores.,
