original,translate
"Woe to me that my wretched life and poor choices has landed me, Caspar of Loral, on this barren rock as the keeper of lights","내 비참한 인생과 어리석은 선택들이 나, 로랄의 카스파를 이 척박한 바위섬의 등대지기로 이끌다니, 비통하도다"
About six months ago,약 6개월 전
Saw lights on the shore near the cave entrance,동굴 입구 근처 해안에서 불빛을 보았다
Smugglers Mathias say,"마티아스는 밀수업자라고 한다"
"He insists we leave them alone and I am forced to abide, though my mind wanders often to that cave and what may lay within","그는 그들을 내버려 두라고 했고 나는 따를 수밖에 없었지만, 내 마음은 자꾸만 그 동굴과 그 안에 무엇이 있을지로 향한다"
About a month ago,약 한 달 전
I cannot take it any more!,더 이상 참을 수가 없다!
The old bastard is driving me mad!,그 늙은이가 날 미치게 만들고 있다!
He spies on me and gives me strange looks,그는 나를 감시하고 이상한 눈으로 쳐다본다
And I’m sure he goes through my things!,그리고 내 물건을 뒤지는 게 틀림없다!
I went for a walk to clear my head and I ended up by the entrance to the sea-cave,머리를 식히러 산책을 나갔다가 해식 동굴 입구까지 가게 되었다
Something is calling me there,무언가 나를 그곳으로 부르고 있다
I hear it even in my sleep,잠결에도 그 소리가 들린다
About a week before your arrival in Idra,이드라 도착 약 일주일 전
Dreams driving me mad!,꿈 때문에 미칠 것 같다!
Always it calls me to the caves,언제나 나를 동굴로 부른다
To the deeper dark that lies beneath where no man has tread for eons,"영겁의 세월 동안 아무도 밟지 않은 지하의 더 깊은 어둠으로"
The looking stone and the ancient sleepers,보는 돌과 고대의 잠든 자들
The blade calls me,칼날이 나를 부른다
I can take no more,더 이상 견딜 수 없다
Smuggler's Journal,밀수업자의 일지
A small leather-bound book,작은 가죽 장정 책입니다
I hate these jobs,이런 일은 정말 싫다
Dropped off and told to guard the cargo until it can be collected,물건을 내려놓고 회수해 갈 때까지 지키라는 지시를 받았다
And whilst the bastards up in the northern cave are living the good life I’m stuck in this hole,"북쪽 동굴에 있는 놈들은 호의호식하는 동안, 나는 이 구멍에 처박혀 있다니"
I sometimes think the Imperial dungeons would be preferable,가끔은 제국 감옥이 더 낫겠다는 생각도 든다
We explored the cave today and found what appears to be an underwater tunnel in one of the dead-ends,오늘 동굴을 탐사하다가 막다른 길 중 한 곳에서 수중 터널로 보이는 것을 발견했다
Bryn insisted we try to swim it but I can think of no worse nightmare than being lost in the dark underwater,"브린은 헤엄쳐 보자고 우겼지만, 어두운 물속에서 길을 잃는 것보다 더 끔찍한 악몽은 상상할 수 없다"
I told him as much and he got agitated,그렇게 말했더니 그는 흥분했다
Yelled something about dreaming of an ancient relic,고대 유물에 대한 꿈을 꿨다느니 뭐라느니 고함을 질렀다
I have no idea what he’s on about,도대체 무슨 소리를 하는 건지 모르겠다
Golden dead!,세상에!
Bryn got attacked by a crab the size of a warhound today!,오늘 브린이 군견만 한 게에게 공격당했다!
Nearly took his leg off!,다리가 잘릴 뻔했다!
Neither of us have seen anything like it before and we can only pray it was alone!,우리 둘 다 그런 건 처음 봤고, 그놈이 혼자였기만을 기도할 뿐이다!
Hope the ship won't be delayed much longer,배가 더 이상 늦어지지 않기를 바란다
Bryn is gone,브린이 사라졌다
I know in my heart he’s gone to the underwater tunnel,마음속으로는 그가 수중 터널로 갔다는 걸 알고 있다
Madness!,미친 짓이야!
Shapes are moving in the dark now,이제 어둠 속에서 형체들이 움직인다
No way out and no one is coming for me!,나갈 길은 없고 아무도 구하러 오지 않아!
Light is failing,빛이 꺼져간다
Mother,어머니
Marita's Cookbook,마리타의 요리책
A humble cookbook,소박한 요리책입니다
VEGETABLE SOUP,야채 수프
Potatoes - Carrots - Leeks,감자 - 당근 - 대파
All of the above can be found growing in our field,위 재료들은 모두 우리 밭에서 구할 수 있음
FARMER'S OMELETTE,농부의 오믈렛
x Eggs - Potatoes - Onions,달걀 - 감자 - 양파
Sea bird eggs will do just fine,바닷새 알이면 충분함
Onions grow wild in abundance,양파는 야생에서 흔하게 자람
Cabal Journal,카발의 일지
A journal that appears to have been written by one of the members of the Cabal expedition,카발 원정대원 중 한 명이 작성한 것으로 보이는 일지입니다
This one was found in the base-camp,이것은 베이스캠프에서 발견되었습니다
ENTRY,기록
We’ve finally arrived at the Priory and found it in shockingly good condition,드디어 수도원에 도착했는데 상태가 놀라울 정도로 양호하다
It’s as if time has stood still here,마치 이곳의 시간은 멈춘 것 같다
The initial survey does not reveal a clear means of accessing the lower level but I’m confident we’ll find a way given enough time,"초기 조사에서는 하층으로 가는 확실한 방법을 찾지 못했지만, 시간만 충분하다면 방법을 찾을 수 있을 거라 확신한다"
This place boggles the mind,이곳은 정말 믿기지 않는다
It appears to stand as it was left millennia ago,수천 년 전에 남겨진 모습 그대로 서 있는 것 같다
How it could have slipped so well out of time and history is truly a mystery to me,어떻게 시간과 역사에서 이토록 완벽하게 비켜날 수 있었는지 정말 미스터리다
As is the fate of the Priory’s original occupants,수도원의 원래 거주자들의 운명 또한 그렇다
Still no success in finding the door to the catacombs,아직 지하 묘지로 가는 문을 찾지 못했다
I can only conclude it’s somehow concealed,어딘가 숨겨져 있다고 결론 내릴 수밖에 없다
"We did, however, make an interesting discovery","하지만, 흥미로운 발견을 했다"
The four statues on the “pilgrim’s road” can be rotated,'순례자의 길'에 있는 네 개의 조각상을 회전시킬 수 있다
I’m certain this is somehow significant!,이것이 뭔가 중요한 의미가 있다고 확신한다!
Some form of disease is spreading amongst the men,대원들 사이에 일종의 질병이 퍼지고 있다
Abdominal pain and swelling combined with fevers,"복통과 부종, 그리고 발열을 동반한다"
Our apothecary is so far at a loss at curing it but suggests that proximity to the fungal growths that started sprouting is a potential vector of infection,"약제사는 아직 치료법을 찾지 못했지만, 싹트기 시작한 곰팡이 증식물 근처에 가는 것이 감염 경로일 수 있다고 추측하고 있다"
I’ve ordered that masks be worn near the growths,증식물 근처에서는 마스크를 착용하라고 지시했다
A breakthrough,획기적 발견
We found a document in the scriptorium with a verse on it!,필사실에서 시구가 적힌 문서를 발견했다!
It’s so clear now,이제 모든 것이 명확해졌다
The portal had been hidden in plain sight all along - all it took to open it was the correct configuration of the statues!,입구는 줄곧 눈에 띄는 곳에 숨겨져 있었다. 조각상을 올바른 배열로 맞추기만 하면 되는 것이었다!
The dreaming halls await!,꿈꾸는 전당이 기다린다!
A journal that appears to have been written by one of the members of the Cabal expedition that was dispatched to the Priory,수도원에 파견된 카발 원정대원 중 한 명이 작성한 것으로 보이는 일지입니다
This one was found on a cocooned corpse in the catacombs,이것은 지하 묘지의 고치에 싸인 시체에서 발견되었습니다
We entered the ‘Dreaming Hall’ today,"오늘 '꿈꾸는 전당'에 진입했다"
I’m awestruck by the mystery of it all,이 모든 것의 신비로움에 경외감을 느낀다
What secrets did the Sleeper whisper to the monks as they dreamed?,잠든 자는 꿈꾸는 수도사들에게 어떤 비밀을 속삭였을까?
We must push on and soon enough we too shall stand before his timeless glory,"계속 나아가야 한다. 머지않아 우리 또한 그의 영원한 영광 앞에 서게 될 것이다"
"By the Maiden’s, we found it!","처녀신이시여, 우리가 찾았습니다!"
The tomb in all its glory,그 웅장한 자태의 무덤을
We lost two members to traps trying to enter the room but it’s only a matter of time now,"방에 들어가려다 함정에 걸려 두 명을 잃었지만, 이제 시간문제일 뿐이다"
This is a disaster!,재앙이다!
I know there is something here - calling for us!,여기에 무언가가 있다 - 우리를 부르고 있다!
There must be some other way?,다른 방법이 분명히 있을 텐데?
Several pages are ruined from the fungal infection,몇 페이지는 곰팡이 감염으로 훼손되었습니다
to move in and out of the caves and continue excavating the Eternity Gate,동굴을 드나들며 영원의 문 발굴을 계속하기 위해
My greatest concern at this point is the rate at which we are losing crew to suicides and infection,지금 가장 큰 걱정은 자살과 감염으로 대원들을 잃는 속도다
I saw them change before my very eyes!,그들이 눈앞에서 변하는 것을 보았다!
"Oh, blessed Maidens I may have escaped for now but I cannot escape the images that now haunt me","오, 축복받은 처녀들이여; 지금은 탈출했을지 몰라도, 나를 괴롭히는 그 환영들로부터는 벗어날 수 없습니다"
"What’s worse, the entire complex is somehow resealing itself and I’m trapped between the false tomb and the surface level","설상가상으로, 시설 전체가 어떻게든 다시 봉인되고 있어 나는 가짜 무덤과 지표면 사이에 갇혀버렸다"
I can only pray someone is left alive topside to open the gate,지상에 누군가 살아남아 문을 열어주기만을 기도할 뿐이다
This one was found on a corpse in the catacombs,이것은 지하 묘지의 시체에서 발견되었습니다
They’ve found the secret passage to some kind of cave below the false tomb,가짜 무덤 아래 어떤 동굴로 이어지는 비밀 통로를 찾았다고 한다
Something far older than the Priory itself,수도원보다 훨씬 더 오래된 무언가
Older than the Empire even is the talk around camp,"제국보다 더 오래되었다는 이야기가 캠프에 돌고 있다"
I just wish my insides didn’t hurt as much,속이 이렇게 아프지만 않았으면 좋겠다
They’re sending me down with the next shipment of tools,다음 공구 운송 때 나를 내려보낸다고 한다
That means passing the ‘night-maze’,"'밤의 미로'를 지나야 한다는 뜻이다"
They say it can’t be lit even by magical lighting,"마법 조명으로도 밝힐 수 없다고 한다"
I hate the dark,어둠이 정말 싫다
Apparently it’s easy enough to navigate if you know how,"방법만 알면 길 찾기는 꽤 쉽다고 한다"
South until you hit the first wall and then west until wall - north until wall - west until wall - north until wall - west until wall - then north and you’re there,"남쪽으로 첫 번째 벽에 닿을 때까지; 그다음 서쪽으로 벽까지; 북쪽으로 벽까지; 서쪽으로 벽까지; 북쪽으로 벽까지; 서쪽으로 벽까지 - 그리고 북쪽으로 가면 도착이다"
I went all the way to the sanctum this time,이번엔 성소까지 쭉 들어갔다
By the Golden how I wish I had not,"황금의 신이시여, 그러지 말았어야 했는데"
How can such a thing be?,어떻게 그런 게 있을 수 있지?
The writing becomes rushed,글씨가 급하게 휘갈겨져 있습니다
Hear screams below,아래에서 비명 소리가 들린다
Something is wrong,뭔가 잘못됐다
Save us!,살려줘!
#Clothing,#의복
Clothing,의복
Apron,앞치마
Dress,드레스
Commoner's Garb,평민 의복
Rough but functional woolen clothing that serves the hard-working commoners of the empire well,거칠지만 실용적인 양모 옷으로 제국의 근면한 평민들이 즐겨 입습니다
Bravo's Outfit,무법자 의상
Checkered Tunic,체크무늬 튜닉
Doublet,더블릿
Noble's Outfit,귀족 의상
Pants,바지
Rags,누더기
Ranger's Outfit,순찰자 의상
Robes,로브
Flashy Shirt,화려한 셔츠
Short Pants,반바지
Comfortable Outfit,편안한 의상
Tabard,휘장
Toga,토가
Traveler's Garb,여행자 의복
Rough but functional woolen clothing,거칠지만 실용적인 양모 옷입니다
Well suited for travel and adventuring if you can learn to live with the itching,가려움만 참을 수 있다면 여행과 모험에 아주 적합합니다
Tribal Sash,부족 허리띠
Furs,털가죽
#Consumeables,#소모품
Consume,섭취
Consumable,소모품
Brandy,브랜디
A bottle of strong Gorremian brandy,독한 고레미아산 브랜디 한 병입니다
The tired old mercenary's best friend,지친 늙은 용병의 가장 좋은 친구죠
Potion of Cure Disease,질병 치료 물약
Potion of Cure Poison,해독 물약
Firgol Cider,피르골 사과주
"Sparkling and sweet, this cider comes from the slow-growing orchards of Firgol","톡 쏘고 달콤한 이 사과주는 피르골의 천천히 자라는 과수원에서 생산됩니다"
Many claim it’s the best in all of the Northern Empire whilst a handful of bad apples will complain it’s too sweet,"많은 이들이 북부 제국 최고라고 칭송하지만, 몇몇 불평분자들은 너무 달다고 불평하기도 합니다"
Potion of Greater Restoration,상급 회복 물약
Greater Tonic of Vitality,상급 활력 강장제
Lesser Tonic of Vitality,하급 활력 강장제
Moderate Tonic of Vitality,중급 활력 강장제
Potion of Acid Immunity,산성 면역 물약
Potion of Electric Immunity,전기 면역 물약
Potion of Fire Immunity,화염 면역 물약
Potion of Panic Immunity,공황 면역 물약
Greater Attunement Tonic,상급 마력 조율 강장제
Lesser Attunement Tonic,하급 마력 조율 강장제
Moderate Attunement Tonic,중급 마력 조율 강장제
Mead,벌꿀주
A sweet alcoholic brew made from honey,꿀로 만든 달콤한 술입니다
Widely enjoyed in all of the Northern Empire and the Outer Isles,북부 제국 전역과 외곽 제도에서 널리 즐깁니다
Potion of Agility,민첩 물약
Potion of Bless,축복 물약
Potion of Diamond Form,다이아몬드 형상 물약
Potion of Fortify Will,의지력 강화 물약
Potion of Frenzy,광란 물약
Potion of Heroism,영웅심 물약
Potion of Regeneration,재생 물약
Potion of Speed,속도 물약
Potion of Stone Skin,돌 피부 물약
Potion of Strength,힘 물약
Potion of Acid Resistance,산성 저항 물약
Potion of Electric Resistance,전기 저항 물약
Potion of Fire Resistance,화염 저항 물약
#Foods,#음식
Apple,사과
"Whilst its ability to keep the medicae away has yet to be proven, this common fruit can be found growing on trees in the summer months and is a staple in the pantry of peasants and noblemen alike","의사를 멀리하게 해 준다는 효능은 아직 입증되지 않았지만, 여름철 나무에서 열리는 이 흔한 과일은 농민과 귀족 모두의 식료품 저장고에 있는 주식입니다"
Bacon,베이컨
There is truly no better way to start the day than with a fresh chunk of this salted pork,이 소금에 절인 돼지고기 한 조각으로 하루를 시작하는 것보다 더 좋은 방법은 없습니다
Dark Bread,검은 빵
A piece of the traditional dark and heavy full-grain bread that is eaten throughout the region by farmers and laborers,이 지역 농부와 노동자들이 즐겨 먹는 전통적인 검고 묵직한 통곡물 빵 한 조각입니다
Butter,버터
"Due to its affordability, the rich and creamy, salted butter from Heartlander cows is a popular source of nourishment amongst the lower classes of the Empire","저렴한 가격 덕분에, 하트랜드 젖소의 풍부하고 크리미한 가염 버터는 제국 하층민들에게 인기 있는 영양 공급원입니다"
There’s nothing butter,버터보다 더 좋은 건 없죠
Carrot,당근
"Abundant and healthy, carrots are a staple in the soups and stews of the north","풍부하고 건강에 좋은 당근은 북부의 다양한 수프와 스튜에 들어가는 주재료입니다"
"Also, Hospitallers claim they improve your night-sight","또한, 구호 기사들은 당근이 야간 시력을 향상시킨다고 주장합니다"
Cheddar,체다 치즈
"Made from cow's milk, this cheese is common and beloved throughout the Imperial heartlands","우유로 만든 이 치즈는 제국 심장부 전역에서 흔하게 볼 수 있으며 사랑받는 식품입니다"
Perfect for eating with bread and ham,빵이나 햄과 함께 먹기에 완벽합니다
Sheep's Milk Cheese,양젖 치즈
As inexpensive and filling as it is smelly,냄새만큼이나 저렴하고 배를 채우기 좋습니다
Sheep's milk cheese is a staple in the northern Hinterlands,양젖 치즈는 북부 내륙 지방의 주식입니다
Crab,게
"Many of the Empire’s citizens will pay a pretty penny to get their hands on this soft, sweet meat","제국의 많은 시민들은 이 부드럽고 달콤한 살을 맛보기 위해 꽤 많은 돈을 지불할 것입니다"
"Boiled in salted water and served on white bread with melted butter and squeezed lemon, crab-meat is truly a feast","소금물에 삶아 녹인 버터와 레몬즙을 곁들여 흰 빵 위에 얹어 먹는 게살은 그야말로 별미입니다"
Cream,크림
Rich and creamy,풍부하고 크리미합니다
Don’t let the cat have it,고양이에게 주지 마세요
Dried Meat,말린 고기
"A favorite amongst adventures, this smoky, preserved meat can last longer than most people’s lives","모험가들이 가장 좋아하는 이 훈제 보존육은 웬만한 사람의 수명보다 더 오래갑니다"
Eel,장어
"Due to their abundance in both rivers and oceans, eels are one of the most popular seafoods in the Empire","강과 바다 모두에서 풍부하게 잡히기 때문에, 장어는 제국에서 가장 인기 있는 해산물 중 하나입니다"
"So popular, in fact, that some citizens have even been known to accept them as payment","실제로 인기가 너무 좋아 일부 시민들은 대금으로 받기도 한다고 알려져 있습니다"
Eggs,달걀
Don't put them all in one basket,한 바구니에 다 담지 마세요
Perklin,퍼클린
The humble perklin makes up for its meager size with its abundance,소박한 작은 물고기인 퍼클린은 그 빈약한 크기를 엄청난 숫자로 만회합니다
It's often perserved with salt and eaten year round,종종 소금에 절여 일 년 내내 먹습니다
The smell is an acquired taste,냄새에 익숙해지는 데는 시간이 좀 걸립니다
Redman,레드맨
The tongue and eyes of the redman swells grotesquely once it's pulled from the depth in which it dwells,심해에 사는 레드맨은 물 밖으로 끌려 나오면 혀와 눈이 기괴하게 부풀어 오릅니다
"Despite its apperance, however, its flesh is considered a delicacy when served baked with lemons and vegetables","하지만 그 외관에도 불구하고, 레몬과 야채를 곁들여 구워내면 그 살코기는 별미로 여겨집니다"
Steel-Fin,강철 지느러미
Dead fish eyes stare up at you,죽은 물고기의 눈이 당신을 올려다봅니다
Steel-Fin is a staple on dinner tables throughout the Outer Isles,강철 지느러미는 외곽 제도 전역의 저녁 식탁에 오르는 주식입니다
It's commonly eaten in hearthy stews with vegetables,보통 야채와 함께 든든한 스튜로 만들어 먹습니다
Flour,밀가루
One of the greatest of the Gallian Miracles was the turning of deserts into the great rolling wheat fields that now constitute a large portion of the Heartland,갈리아의 가장 위대한 기적 중 하나는 사막을 현재 심장부의 대부분을 차지하는 광활한 밀밭으로 바꾼 것입니다
From these flows countless tons of grain and rich white flour,이곳에서 수많은 톤의 곡물과 풍부한 흰 밀가루가 쏟아져 나옵니다
Garlic,마늘
"Pungent and full of flavor, this herb is most frequently used to enhance a variety of meals","톡 쏘는 맛과 풍미가 가득한 이 허브는 다양한 요리의 맛을 돋우는 데 가장 자주 사용됩니다"
Cured Ham,숙성 햄
"Tender, savory and long lasting","부드럽고 짭짤하며 오래 보관할 수 있습니다"
Cured ham is found in the cellar of every well-to-do merchant and petty noble in the Empire,숙성 햄은 제국의 부유한 상인이나 하급 귀족들의 지하 저장고라면 어디서든 볼 수 있습니다
Honey,꿀
"Sticky and sweet, this ingredient is often used by cooks to sweeten or preserve food, and is a staple in every mead-makers arsenal","끈적하고 달콤한 이 재료는 요리사들이 음식의 단맛을 내거나 보존할 때 자주 사용하며, 모든 벌꿀주 양조업자의 필수품입니다"
It is even said to have curative properties when applied to infected wounds,감염된 상처에 바르면 치료 효과가 있다는 말도 있습니다
Leeks,대파
"Beyond just the taste, leeks go a long way towards adding some color to the drab cuisine of the poor","단순한 맛을 넘어, 대파는 가난한 이들의 칙칙한 요리에 색을 더하는 데 큰 역할을 합니다"
Lemons,레몬
"In the north, lemons are almost exclusively found on ships where they serve to protect the sailors from the terrible scurvy that prolonged idleness and sexual abstinence is known to cause","북부에서 레몬은 거의 전적으로 배 위에서만 볼 수 있는데, 오랜 나태함과 금욕이 유발한다고 알려진 끔찍한 괴혈병으로부터 선원들을 보호하는 역할을 합니다. 항해와 너무나 밀접한 관련이 있어, 레몬을 운송하는 제국의 선원들은 ""레몬 먹는 놈들(lemon-eaters)"" 또는 줄여서 ""리모니(limony)""라고 불리며, 더 나아가 모든 뱃사람을 지칭하기도 합니다"
Baked Crab,구운 게
The crab flesh is coated in spiced butter before baking in the oven to perfection,게살에 양념 버터를 바른 뒤 오븐에서 완벽하게 구워냈습니다
Baked Mushrooms,구운 버섯
The nutty flavor of the wyrdloaf mixes wonderfully with the aromas of garlic to produce a meal fit for an emperor,위드로프(Wyrdloaf) 버섯의 고소한 맛이 마늘 향과 어우러져 황제에게 어울릴 만한 요리를 만들어냅니다
Baked Onions,구운 양파
"Onions are easily grow, keep for long and go a long ways towards covering up the taste of half-spoiled fish or meat","양파는 기르기 쉽고 오래 보관할 수 있으며, 반쯤 상한 생선이나 고기의 맛을 가리는 데 아주 유용합니다"
Baked Oysters,구운 굴
Tender oysters coated in bread-crumbs and baked until just right,부드러운 굴에 빵가루를 입혀 알맞게 구워냈습니다
You just hope the oysters were fresh,굴이 신선했기를 바랄 뿐입니다
Baked Potato,구운 감자
It is said that potatoes alone can nourish a man's body indefinitely,감자 하나만으로도 사람의 몸을 영원히 지탱할 수 있다고 합니다
The same cannot be said for his soul,영혼에 대해서는 장담할 수 없지만요
Beef Stew,소고기 스튜
"A thick, hearty stew of beef cooked in rich, Ombarian wine","진한 옴바리아산 와인으로 조리한 걸쭉하고 든든한 소고기 스튜입니다"
Cheese Plate,치즈 접시
"Ah, the understated elegance of a cheese and fruit plate","아, 치즈와 과일 접시의 절제된 우아함이란"
Eggs and Bacon,베이컨과 달걀
The breakfast of titans,거인들의 아침 식사입니다
Baked Fish,생선 구이
"A delicious-looking plate of baked, white fish on a bed of vegetables seasoned with freshly squeezed lemon","갓 짠 레몬으로 맛을 낸 야채 위에 올려진 먹음직스러운 흰 살 생선 구이입니다"
Salted Fish,절인 생선
The fisherman's best friend,어부의 가장 좋은 친구죠
Preferably eaten with a mug of ale on the side,에일 한 잔을 곁들여 먹는 것이 가장 좋습니다
Fish Stew,생선 스튜
A steaming bowl of fish and vegetable stew,김이 모락모락 나는 생선 야채 스튜 한 그릇입니다
This type of dish is eaten more or less daily by the coast-dwellers of the north,이런 종류의 요리는 북부 해안 거주민들이 거의 매일 먹는 음식입니다
It could do with some salt,소금과 레몬즙이 좀 더 필요할 것 같군요
Grilled Leeks,구운 대파
Mashed Potatoes,으깬 감자
Just the way mothers all over the Empire would make it!,제국 전역의 어머니들이 만들어 주던 바로 그 맛입니다!
Meat Skewers,고기 꼬치
Richly spiced meat roasted on skewers,꼬치에 끼워 구운 풍부한 향신료 맛의 고기입니다
A popular dish that the Empire imported from its overseas colonies,제국이 해외 식민지에서 들여온 인기 요리입니다
Farmer's Omelette,농부의 오믈렛
"A nice farmer's omelette brings to mind the simple comforts of a quaint, rural life","맛있는 농부의 오믈렛은 소박한 시골 생활의 소소한 편안함을 떠올리게 합니다"
Mushroom Omelette,버섯 오믈렛
The mushroom omelette tastes of the forest,버섯 오믈렛에서는 숲의 맛이 납니다
Apple Pie,애플파이
