original,translate,
There are smugglers on Idra?,There are smugglers on Idra?,
Tell me about Horryn,Tell me about Horryn,
What did you need me to do again?,What did you need me to do again?,
Remind me what you needed!,Remind me what you needed!,
"Actually, I should make ready to leave","Actually, I should make ready to leave",
This here beacon is all's keeping the horrors of this island from my throat!,This beacon 'ere is all that's keeping the horrors of this island from my throat!,
"Thing is, oil is running low and I got nary a drop left in storage","Thing is, oil is running low and I got nary a drop left in storage",
I need you to find me some oil afore darkness takes us!,I need you to find me some oil afore darkness takes us!,
"Thing is, the oil was coming from the mainland on ships through Horryn","Thing is, the oil was coming from the mainland on ships through Horryn",
Then things went dark and now there’s no way for me to get to it,Then things went dark and now there’s no way for me to get to it,
"If it’s still in Horryn, there’s a good chance it’ll be sitting in one of the warehouses in the harbor","If it’s still in Horryn, there’s a good chance it’ll be sitting in one of the warehouses in the harbour",
I'll do my best,I'll do my best,
Show oil,Show oil,
That’s all I ask,That’s all I ask,
"I’ll be waiting here for you, tending the fire as best I can","I’ll be waiting here for you, tending the fire as best I can",
I’m running out of oil!,I’m running out of oil!,
I suspect the shipment is stuck in a warehouse in Horryn and I need you to search for it there,I suspect the shipment is stuck in a warehouse in Horryn and I need you to search for it there,
You’ll likely find it in one of the warehouses on the waterfront,You’ll likely find it in one of the warehouses on the waterfront,
Give oil,Give oil,
"Blessed Dead, I knew you could do it!","Blessed Dead, I knew you could do it!",
"If nothing else, seeing the light still burning bright is bound to give people hope!","How far that little candle throws his beams! If nothing else, seeing the light still burning bright is bound to give people hope!",
Emperor’s Light and all!,Emperor’s Light and all!,
Let's hope so!,Let's hope so!,
All I have to offer in way of reward is my old sword,All I have to offer in way of reward is my old sword,
It once served me well but it's getting too heavy for me now,It once served me well but it's getting too heavy for me now,
"Mathias produces an old, but well-crafted broadsword wrapped in cloth","Mathias produces an old, but well-crafted broadsword wrapped in cloth",
I'll be on my way now,I'll be on my way now,
Ye're back,"Ye're back, I see",
"I knew ye'd seek safe harbor once more, drawn to the light like lost moths","I knew ye'd seek safe harbour once more, drawn to the light like lost moths",
"Well then; Sit, rest, make yourself at home",Well then: sit; rest; make yourself at home,
There might still be some stew left,There might still be some stew left,
I found the black blade,I found the black blade,
I have oil for you!,I have oil for you!,
I don't have time to linger!,I don't have time to linger!,
I can't say I've ever heard about a ship by that name,I can't say I've ever heard about a ship by that name,
"And let me tell you, I've worked this lighthouse for a man’s age and I’ll say this much","And let me tell you, I've worked this lighthouse for a man’s age and I’ll say this much",
There’s no ship to be found around here as far as I know!,There’s no ship to be found around here as far as I know!,
Idra's thick with them,Idra's thick with them,
Carrying wares to the mainland for the Freythen,Carrying wares to the mainland for the Freythen,
Island’s riddled with caves and they use them to store their contraband and whatnot,Island’s riddled with caves and they use them to store their contraband and what-not,
But they keep to themselves and I want no trouble so I let them be,But they keep to themselves and I want no trouble so I let them be,
#Chapter1LighthouseMisc,#Chapter1LighthouseMisc,
"For all its alienness, you still recognize the arcane machinery","For all its alienness, you still recognise the arcane machinery",
An ancient Imperial reticular node,An ancient Imperial reticular node,
You suspect this lighthouse was once fueled by reticular energy and that this machine was part of its operation,You suspect this lighthouse was once fueled by reticular energy and that this machine was part of its operation,
"The stillness and layer of dust, however, tell you that it's long since fallen into disrepair and that the lighthouse is likely now fueled by common oil","The stillness and layer of dust, however, tell you that it's long since fallen into disrepair and that the lighthouse is likely now fueled by common oil",
"As you stand there, beholding the strange machine, you become aware of the scraping of tiny claws in the darkness","As you stand there, beholding the strange machine, you become aware of the scraping of tiny claws in the darkness",
Then chittering,Then chittering,
As you reach for your weapon the strange harmonics of the chittering converge and for the briefest of moments you could have sworn you heard words formed,As you reach for your weapon the strange harmonics of the chittering converge and for the briefest of moments you could have sworn you heard words formed,
Half a dozen beasts launch at you from the dark corners of the room with fangs bared!,Half a dozen beasts launch at you from the dark corners of the room with fangs bared!,
Creeping through the moldy lighthouse cellar you round a corner and stop dead in your tracks,Creeping through the mouldy lighthouse cellar you round a corner and stop dead in your tracks,
"Rising up through the core of the tower, is a grotesque-looking metallic monstrosity","Rising up through the core of the tower, is a grotesque-looking metallic monstrosity",
The strangely organic shapes and odd geometries seem to writhe in the dim light and the burnished sylver coating casts a ghostly reflection on the walls,The strangely organic shapes and odd geometries seem to writhe in the dim light and the burnished sylver coating casts a ghostly reflection on the walls,
#Chapter1LighthouseQuest,#Chapter1LighthouseQuest,
There is nothing more you can do for me right now,There is nothing more you can do for me right now,
What of it?,What of it?,
What can I do to help?,What can I do to help?,
About that job,About that job,
Remind me what you need,Remind me what you need,
I have the oil!,I have the oil!,
Glad to help,Glad to help,
Mathias stares absent mindedly into the fire,Mathias stares absentmindedly into the fire,
I was wondering about something else,I was wondering about something else,
It's time to leave,It's time to leave,
#Chapter1UWMaze,#Chapter1UWMaze,
"You utter an underwater scream of pain and terror but before you can act further, the creature has retreated back into one of the holes","You utter an underwater scream of pain and terror but before you can act further, the creature has retreated back into one of the holes",
Swim south,Swim south,
"Quickly rummaging through the poor fellows belongings, you try not to think about your own dwindling air supply","Quickly rummaging through the poor fellows belongings, you try not to think about your own dwindling air supply",
In a pouch on his belt you find a handful of coins and a key,In a pouch on his belt you find a handful of coins and a key,
"Now, you’ve lingered too long already and you must move on","Now, you’ve lingered too long already and you must move on",
Tunnels lead to the north and west,Tunnels lead to the north and west,
Swim north,Swim north,
Swim west,Swim west,
You break the surface and find yourself back in the cave system where you started,You break the surface and find yourself back in the cave system where you started,
"For all its bleakness, you nonetheless feel a sense of relief at returning to this area","For all its bleakness, you nonetheless feel a sense of relief at returning to this area",
You break the surface and emerge into an alien world,You break the surface and emerge into an alien world,
The air is stale and damp and the walls are so covered in algae and fungus that they almost appear to writhe,The air is stale and damp and the walls are so covered in algae and fungus that they almost appear to writhe,
"In the faint bioluminescence of the cave's bizarre underwater flora, you make out three passages","In the faint bioluminescence of the cave's bizarre underwater flora, you make out three passages",
North and east takes you further into the cave system whilst west leads back to the surface,"Both north and east take you further into the cave system, whilst west leads back to the surface",
Swim east,Swim east,
A large domed chamber,A large domed chamber,
Writing sea-weed covers the floor and reaches up towards you like groping tentacles,Writing seaweed covers the floor and reaches up towards you like groping tentacles,
You shudder as one of the slimy tendrils brush your skin,You shudder as one of the slimy tendrils brush your skin,
Three tunnels lead out of this chamber,Three tunnels lead out of this chamber,
"East, west and south","East, west, and south",
The tunnel narrows somewhat here before opening up into a slightly larger chamber with two exits,The tunnel narrows somewhat here before opening up into a slightly larger chamber with two exits,
West and south,West and south,
The bioluminescence is so faint in this chamber that you almost fail to spot the tunnels leading north and east,The bioluminescence is so faint in this chamber that you almost fail to spot the tunnels leading north and eastward,
Suspended in the middle of this chamber is the corpse of a young man,Suspended in the middle of this chamber is the corpse of a young man,
His features are softened by the sickly glow of the algae growing here but there is no mistaking the mask of terror that froze on his face as he drowned,His features are softened by the sickly glow of the algae growing here but there is no mistaking the mask of terror that froze on his face as he drowned,
A bend where the tunnel leads east or south,A bend where the tunnel leads east or south,
Sharp limpet-like growths cover the wall and you take care not to cut yourself as you squeeze past,Sharp limpet-like growths cover the wall and you take care not to cut yourself as you squeeze past,
"This chamber is flat with a low ceiling and three tunnels leading north, east and west","This chamber is flat with a low ceiling and three tunnels leading north, east, and west",
The walls of this bulbous chamber are pockmarked with a dozen smaller tube-like holes leading deeper into the bedrock,The walls of this bulbous chamber are pockmarked with a dozen smaller tube-like holes leading deeper into the bedrock,
"As you contemplate the folly of sticking your hand into one of them, an eel-like creature darts from one of the holes and bites into your flesh with tiny, razor sharp fangs","As you contemplate the folly of sticking your hand into one of them, an eel-like creature darts from one of the holes and bites into your flesh with tiny, razor sharp fangs",
This chamber is bathed in a greenish glow coming from the eastern tunnel that leads to the surface,This chamber is bathed in a greenish glow coming from the eastern tunnel that leads to the surface,
The western exit leads deeper into the cave system,The western exit leads deeper into the cave system,
Underwater Tunnel,Underwater Tunnel,
You find yourself at the opening of a narrow underwater tunnel and wonder how long you can hold your breath,You find yourself at the opening of a narrow underwater tunnel and wonder how long you can hold your breath,
Do you dive in?,Do you dive in?,
Dive into the tunnel,Dive into the tunnel,
This narrow underwater tunnel serves as the only exit from this cave,This narrow underwater tunnel serves as the only exit from this cave,
You hope you remember the way back,You hope you remember the way back,
#SantaFury,#SantaFury,
Carylla,Carylla,
"A sinewy, armored woman with a shield slung on her back and a broadsword at her side stands by a small campfire","A sinewy, armoured woman with a shield slung on her back and a broadsword at her side stands by a small campfire",
She’s grunting and cursing under her breath as she clumsily tries to bind a wound on her arm,She’s grunting and cursing under her breath as she clumsily tries to bind a wound on her arm,
Dried blood and mud cakes her face and armor and she looks haggard,Dried blood and mud cakes her face and armor and she looks haggard,
She freezes as she sees you emerge from the fog,She freezes as she sees you emerge from the fog,
A suspicious frown falls over her face,A suspicious frown falls over her face,
Let me help you!,Let me help you!,
she growls as she finishes the tourniquet using her good arm and teeth,she growls as she finishes the tourniquet using her good arm and teeth,
Bless you for offering but I can manage,"Bless you for offering, but I can manage",
I would kill for some water though!,I would kill for some water though!,
Offer her a drink from your waterskin,Offer her a drink from your waterskin,
Name’s Carylla,Name’s Carylla,
Used to call myself captain of our little mercenary company,Used to call myself captain of our little mercenary company,
Some rich trader from Adler’s paid us well to come here and look for the Fury,Some rich trader from Adler’s paid us well to come here and look for the Fury,
Things went to shit quickly,Things went to shit quickly,
I’ve been losing my crew one by one,I’ve been losing my crew one by one,
Nillas and Pieter ‘got their coins’ yesterday,Nillas and Pieter ‘got their coins’ yesterday,
Torn to pieces by those fucking hounds,Torn to pieces by those fucking hounds,
It’s just me now,It’s just me now,
What’s the Fury?,What’s the Fury?,
Carylla packs up her gear and begins to carefully make her way through the mist until she’s gone,Carylla packs up her gear and begins to carefully make her way through the mist until she’s gone,
I would hate to see you spill your guts on this bloody island looking for some ghost-ship,I would hate to see you spill your guts on this bloody island looking for some ghost ship,
"Then again, you might have better luck then me and my","Then again, you might have better luck then me and my–",
Carylla stops briefly and her eyes water up,Carylla stops briefly and her eyes water up,
Just be careful,Just be careful. It's dangerous to go alone,
Idra’s not peaceful any more and I suspect there are things out in the mist far worse than the hounds,Idra’s not peaceful any more and I suspect there are things out in the mist far worse than the hounds,
Honestly I don’t know where to start,Honestly I don’t know where to start,
There were lights in the sky,There were lights in the sky,
Flashes and orbs,Flashes and orbs,
Some over Horryn and others over the island’s interior,Some over Horryn and others over the island’s interior,
Minor quakes even,Minor quakes even,
And then things went real bad,And then things went real bad,
People lost their minds and animals started changing,People lost their minds and animals started changing,
What terrifies me is I can’t even tell you how long that was ago!,What terrifies me is I can’t even tell you how long that was ago!,
Her voice rises in an anxious tone,Her voice rises in an anxious tone,
I just need to get away from here!,I just need to get away from here!,
Off this fucking rock!,Off this fucking rock!,
What will you do now?,What will you do now?,
"I’ll try to make my way east, around the bay","I’ll try to make my way east, around the bay",
Maybe there are larger groups of survivors there and perhaps even someone with a way of getting away from here,Maybe there are larger groups of survivors there and perhaps even someone with a way of getting away from here,
"And if you ever find that bloody treasure, buy me a drink next time we run into each other","And if you ever find that bloody treasure, buy me a drink next time we run into each other",
A Painting,A Painting,
"Hanging on the wall, you see a dramatic but not particularly artful painting of a ship with torn sails caught in a terrible storm","Hanging on the wall, you see a dramatic but not particularly artful painting of a ship with torn sails caught in a terrible storm",
Your mind wanders to the Zephyr and its grizzly fate and you shudder,Your mind wanders to the Zephyr and its grizzly fate and you shudder,
Look closer,Look closer,
Leaning in you notice that there is a name painted on the side of the ship,Leaning in you notice that there is a name painted on the side of the ship,
The Santa Fury,The Santa Fury,
Could this be it?,Could this be it?,
Is this what the rumor that the Santa Fury could be found near the lighthouse on Idra meant?,Is this what the rumour that the Santa Fury could be found near the lighthouse on Idra meant?,
Examine the painting even closer,Examine the painting even closer,
Examining the painting more carefully reveals nothing,Examining the painting more carefully reveals nothing,
Not until you turn it over!,Not until you turn it over!,
Written in faint lettering in the lower left corner of the painting's backside you can clearly make out a poem of sorts,Written in faint lettering in the lower left corner of the painting's backside you can clearly make out a poem of sorts,
The Poem,The Poem,
"From the center of the three, The Santy Fury made her flight","From the centre of the three, The Santy Fury made her flight",
"Setting out to hide her booty, All within the lighthouse's sight","Setting out to hide her booty, All within the lighthouse's sight",
"leagues south began her trip, ""5 east"" the Captain cried. 4 more north, our valiant ship, Our plunder we shall hide!","leagues south began her trip, ""5 east"" the Captain cried. 4 more north, our valiant ship, Our plunder we shall hide!",
Land ahoy!,Land ahoy!,
went up the roar,went up the roar,
We'll lay our treasure there!,We'll lay our treasure there!,
"Into the rising sun: 3 more, Then dig and have no fear!","Into the rising sun: 3 more, Then dig and have no fear!",
You hastily take down the poem in your journal,You hastily take down the poem in your journal,
Excitement washes over you as you realize that you may in fact be on the trail of something more than an old sailor’s tale!,Excitement washes over you as you realise that you may in fact be on the trail of something more than an old sailor’s tale!,
If you can make sense of the poem that is,If you can make sense of the poem that is,
A wise call,A wise call,
You may go far yet,You may go far yet,
But a friendly piece of advice between colleagues,But a friendly piece of advice between colleagues,
Don’t search for us,Don’t search for us,
Forget this ever happened and move on,Forget this ever happened and move on,
She offers a short bow before the group dissolves back into the fog with the idol in hand,She offers a short bow before the group dissolves back into the fog with the idol in hand,
Silence descends around you as you pick up the jewelry left behind,Silence descends around you as you pick up the jewelry left behind,
It will certainly fetch a nice purse,It will certainly fetch a nice purse,
Yet you cannot shake the image of that grotesque idol from your mind,Yet you cannot shake the image of that grotesque idol from your mind,
Part of you prays you never see it again whilst another knows with absolute certainty you will,Part of you prays you never see it again whilst another knows with absolute certainty you will,
What!,What!,
Never heard of the Santa Fury?,Never heard of the Santa Fury?,
"She was an Ombarian treasure-ship, they say","She was an Ombarian treasure ship, they say",
Disappeared around 40 cycles ago and it’s said she was laden heavy when she went,Disappeared around forty cycles ago and it’s said she was laden heavy when she went,
People been looking for her ever since,People been looking for her ever since,
"Me, I never put any stock in the legend","Me, I never put any stock in the legend",
Sailor’s tale,Sailor’s tale,
But then this rich fop from Adler’s up and offered to pay me and my company to go here and look for it,But then this rich fop from Adler’s up and offered to pay me and my company to go here and look for it,
"Well, 'easy money' we thought","Well, 'easy money' we thought",
"Idra’s not huge and according to the trader, rumor had it she lay on dry land near the lighthouse","Idra’s not huge and according to the trader, rumour had it she lay on dry land near the lighthouse",
"And there’s only one lighthouse on Idra see, so sounded easy enough","And there’s only one lighthouse on Idra, see; so sounded easy enough",
No reason to expect any bloodshed either,"No reason to expect any bloodshed, either",
Idra used to be nice and peaceful,Idra used to be nice and peaceful,
Our steel was mostly in case we did find it and needed to guard any treasure,Our steel was mostly in case we did find it and needed to guard any treasure,
"Needless to say, that’s not how it went","Needless to say, that’s not how it went",
You didn’t find anything?,You didn’t find anything?,
Not a scrap,Not a scrap,
We've searched every inch of this island and let me tell you,We've searched every inch of this island and let me tell you,
The Santa Fury’s not here!,The Santa Fury’s not here!,
It bloody can’t be!,It bloody can’t be!,
A fucking ship on dry land?,A fucking ship on dry land?,
And near the lighthouse nonetheless?,And near the lighthouse nonetheless?,
It does not exist!,It does not exist!,
Mind if I give it a go?,Mind if I give it a go?,
Buried Treasure,Buried Treasure,
"Digging through the rocky soil, you’re almost ready to give up then your shovel suddenly strikes something metallic","Digging through the rocky soil, you’re almost ready to give up then your shovel suddenly strikes something metallic",
A small but sturdy strong-box,A small but sturdy strong-box,
"Though it appears to have something inside, this is far from the fabled mountains of gold that Ombarian treasure-ships were said to carry","Though it appears to have something inside, this is far from the fabled mountains of gold that Ombarian treasure ships were said to carry",
Open the box,Open the box,
The box swings open without difficulty,The box swings open without difficulty,
Inside lies a small pile of strange and exotic looking jewelry,Inside lies a small pile of strange and exotic looking jewellery,
And underneath it: an artifact wrapped in rough linen,And underneath it: an artifact wrapped in rough linen,
"As you reach for it, a ringing rises in your ears and you go light headed","As you reach for it, a ringing rises in your ears and you go light-headed",
Excitement?,Excitement?,
Something else,Something else,
"The bundle tumbles from your hands and as it does, it becomes unwrapped","The bundle tumbles from your hands and as it does, it becomes unwrapped",
Laying on the ground in front of you is a hideous idol carved from some unknown greenish-black rock,Laying on the ground in front of you is a hideous idol carved from some unknown greenish-black rock,
"An amorphous shape of eyes, mouths and tentacles that manages to convey a sense of immensity in spite of the effigy’s small size","An amorphous shape of eyes, mouths and tentacles that manages to convey a sense of immensity in spite of the effigy’s small size",
Hand over the idol,Hand over the idol,
The voice cuts through the mist like a dagger,The voice cuts through the mist like a dagger,
You turn around to see Carylla and a handful of other shapes approaching threateningly with weapons drawn,You turn around to see Carylla and a handful of other shapes approaching threateningly with weapons drawn,
I can’t bloody believe it!,I can’t bloody believe it!,
It worked!,It worked!,
I told you all it would,I told you all it would,
one of the men flanking Carylla rants excitedly before she cuts him off with a poisonous glance,one of the men flanking Carylla rants excitedly before she cuts him off with a poisonous glance,
Shut your bloody trap Pieter!,"Shut your bloody trap, Pieter!",
You!,You!,
she points her sword towards you,she points her sword towards you,
Hand over the idol!,Hand over the idol!,
Kick it over,Kick it over,
Not going to happen!,Not going to happen!,
The men I work for,The men I work for,
They will go so much further than just spilling your blood to get what they seek,They will go so much further than just spilling your blood to get what they seek,
"A smile, strangely sympathetic, flashes over her face","A smile, strangely sympathetic, flashes over her face",
Then she clicks her tongue and the men flanking her charge!,Then she clicks her tongue and the men flanking her charge!,
#,#,
# Chapter_1_RefugeeCamp,# Chapter_1_RefugeeCamp,
#,#,
#Chapter1Chamberlain,#Chapter1Chamberlain,
"From what I hear, these men were bands of local fishermen and sailors!","From what I hear, these men were bands of local fishermen and sailors!",
But why would they do something like this?,But why would they do something like this?,
"Horryn was their home and for all his shortcomings, there were few Imperial officials as lenient as the governor!","Horryn was their home and for all his shortcomings, there were few Imperial officials as lenient as the governor!",
Where is the governor now?,Where is the governor now?,
I didn't see him as we fle,I didn't see him as we fle–,
I mean 'made our strategic retreat',"I mean, 'made our strategic retreat'",
