original,translate,
"Your lungs are on fire from breathing the thick, dust-laden air and with a final spasm of effort you lunge for the rope","Your lungs are on fire from breathing the thick, dust-laden air and with a final spasm of effort you lunge for the rope",
Pull the rope!,Pull the rope!,
And catch it as you slide along the floor,And catch it as you slide along the floor,
The beam snaps like a twig and instantly gravity asserts its dominance over rock!,The beam snaps like a twig and instantly gravity asserts its dominance over rock!,
"Countless tons crash down in an instant, utterly turning the body of the gargantuan abomination into so much gore","Countless tons crash down in an instant, turning the body of the gargantuan abomination into so much gore",
Falling rocks pummel you and then a huge billowing cloud of choking dust fills the remaining tunnel,Falling rocks pummel you and then a huge billowing cloud of choking dust fills the remaining tunnel,
Couching madly and stumbling about in the dark you nonetheless manage to get your bearings,Couching madly and stumbling about in the dark you nonetheless manage to get your bearings,
"Slowly, you make your way to the exit and into fresh air","Slowly, you make your way to the exit and into fresh air",
For now you must recover from the ordeal and wait for the dust to settle,For now you must recover from your ordeal and wait for the dust to settle,
#GradlaMinesSpottedExit,#GradlaMinesSpottedExit,
I’m not sure,I’m not sure,
I suspect the Deep-Ones never made it to the plateau,I suspect the Deep Ones never made it to the plateau,
"They are creatures of the sea and though they are dangerous enough on land, their reach is limited","They are creatures of the sea and though they are dangerous enough on land, their reach is limited",
Perhaps that is why they were breeding with humans?,Perhaps that is why they were breeding with humans?,
To make hybrids?,To make hybrids?,
What other dangers could be waiting for us then?,"What other dangers could be waiting for us, then?",
Embla’s voice drops to a whisper,Embla’s voice drops to a whisper,
The seven eyes of the Dragon are fixed on the Priory,The seven eyes of the Dragon are fixed on the Priory,
I can feel it,I can feel it,
"It writhes in the void, coveting that which lies below the Priory","It writhes in the void, coveting that which lies below the Priory",
Its tendrils are grasping!,Its tendrils are grasping!,
Your head spins and for an instance you again imagine hearing the chanting of some long dead language in the darkness,Your head spins and for an instance you again imagine hearing the chanting of some long dead language in the darkness,
Let's not speak of such things here in the darkness,Let's not speak of such things here in the darkness,
Let’s move on,Let’s move on,
The statues of two robed figures loom ominously over a doorway carved directly into the mountain with uncanny precision,The statues of two robed figures loom ominously over a doorway carved directly into the mountain with remarkable precision,
"Beyond, a narrow stair with oddly proportioned steps ascends steeply","Beyond, a narrow stair with oddly proportioned steps ascends steeply",
The faintest of wisps of cool mountain air can be felt coming down through the shaft,The faintest of wisps of cool mountain air can be felt coming down through the shaft,
These stairs are not part of the mines,These stairs are not part of the mines,
says Embla as she stares up at the statues in reverence,says Embla as she stares up at the statues in reverence,
They were built by those who built the Priory,They were built by those who built the Priory,
So they lead up to the plateau?,So they lead up to the plateau?,
"Yes, I believe they do","Yes, I believe they do",
"Once we ascend, we’ll be within striking distance of the Priory","Once we ascend, we’ll be within striking distance of the Priory",
"For all we have faced so far, I suspect there is yet much danger ahead","For all we have faced so far, I suspect there is yet much danger ahead",
"In other words, we must be well prepared before we set out","In other words, we must be well prepared before we set out",
Danger?,Danger?,
From the Deep-Ones?,From the Deep Ones?,
#GradlaTownEnter,#GradlaTownEnter,
Something about DeepOnes,Something about DeepOnes,
More about DeepOnes,More about DeepOnes,
Finally the last part about DeepOnes,Finally the last part about DeepOnes,
I need to be on my way,I need to be on my way,
We’ll stay here and for now you can bloody well find your own place to hide,We’ll stay here and for now you can bloody well find your own place to hide,
Come back once it’s safe and we’ll see if we can’t scrounge up some supplies and a warm bed for you,Come back once it’s safe and we’ll see if we can’t scrounge up some supplies and a warm bed for you,
Also,Also,
Be careful and don’t lead those bloody things here if things go bad!,Be careful not to lead those bloody things here if things go bad!,
World's gone mad!,World's gone mad!,
All began with us finding those odd stairs leading up to the plateau with those strange ruins,All began with us finding those odd stairs leading up to the plateau with those strange ruins,
The Company sent an expedition here to investigate it and all,The Company sent an expedition here to investigate it and all,
They set off up onto the plateau and then - nothing,They set off up onto the plateau and then - nothing,
That is until the ‘events’ started!,That is until the ‘events’ started!,
Events?,Events?,
Started with my crew getting these strange dreams,Started with my crew getting these strange dreams,
Then we saw lights dance up over the plateau and heard strange sounds,Then we saw lights dance up over the plateau and heard strange sounds,
Howls almost,Howls almost,
Then came the ‘things’ from the sea,Then came the ‘things’ from the sea,
The man’s voice shakes with terror,The man’s voice shakes with terror,
What 'things'?,What 'things'?,
Things that should not be,Things that should not be,
Scaled things that walk like men,Scaled things that walk like men,
They fell upon us in the night and we didn’t stand a chance,They fell upon us in the night and we didn’t stand a chance,
"I’m not ashamed to say, the only reason I’m still alive is I hid like a frightened child","I’m not ashamed to say, the only reason I’m still alive is I hid like a frightened child",
Emperor’s bones I even pissed myself,Emperor’s bones I even pissed myself,
"Strange thing is, it seems the monster tried to drag people away alive if they could","Strange thing is, it seems the monster tried to drag people away alive if they could",
Dragged them right into the mines if you can believe it,Dragged them right into the mines if you can believe it,
There were screams at first,There were screams at first,
Such horrible screams,Such horrible screams,
But they stopped soon enough,But they stopped soon enough,
We almost thought they’d left and that we could make a run for it!,We almost thought they’d left and that we could make a run for it!,
Then the ships started arriving,Then the ships started arriving,
Mad-men sailing all manners of vessels!,Madmen sailing all manners of vessels!,
Was like they didn’t even try to land properly,Was like they didn’t even try to land properly,
They just beached the ships or ran them onto the reef but that didn’t matter,They just beached the ships or ran them onto the reef but that didn’t matter,
The sea-creatures emerged from the mine to claim the offerings the madmen had brought,The sea creatures emerged from the mine to claim the offerings the madmen had brought,
Fresh captives,Fresh captives,
What happened to the captives?,What happened to the captives?,
"The madmen chanted as the captives were dragged into the mine, same as my crew","The madmen chanted as the captives were dragged into the mine, same as my crew",
We heard them scream as well,We heard them scream as well,
I shudder to think what’s going on down there in the darkness,I shudder to think what’s going on down there in the darkness,
What can you tell me about the mines?,What can you tell me about the mines?,
As you enter the mining camp you are greeted by the sight of carnage,As you enter the mining camp you are greeted by the sight of carnage,
Dead horses and animals litter the small plaza and the only visible sign of life is a lone dog,Dead horses and animals litter the small plaza and the only visible sign of life is a lone dog,
We’ve seen this before,We’ve seen this before,
Embla looks around thoughtfully,Embla looks around thoughtfully,
"You saw the wrecked ships as we came in, right?","You saw the wrecked ships as we came in, right?",
At least some of them came from Horryn and that means there may at least be Reavers about,At least some of them came from Horryn and that means there may at least be Reavers about,
Pst!,Pst!,
Hey you!,Hey you!,
a voice whispers loudly from the nearby building,a voice whispers loudly from the nearby building,
By the Golden!,By the Golden!,
Company’s mounted a rescue!,Company’s mounted a rescue!,
A wild-eyed man is peering at you through a slit in the door,A wild-eyed man is peering at you through a slit in the door,
What company?,What company?,
The… the Gildendelve Mining Charter!,The… the Gildendelve Mining Charter!,
Do you mean to say the company didn’t send you?!,Do you mean to say the company didn’t send you?!,
"Well, aren’t we all fucked then","Well, aren’t we all fucked then",
"Big Lorn, they called me","Big Lorn, they called me",
I’m the foreman here at the mines,I’m the foreman here at the mines,
"Or, I used to be is more like it","Or, I used to be is more like it",
Crew’s all dead or taken into the mines!,Crew’s all dead or taken into the mines!,
Me and a handful of others have been hiding here for days but all the rest are gone!,"Me and a handful of others have been hiding here for days, but all the rest are gone!",
"And begging your pardon, we’re staying right where we are until help arrives!","And begging your pardon, we’re staying right where we are until help arrives!",
"What, you won't let me in?","What, you won't let me in?",
I shouldn’t even be talking to you!,I shouldn’t even be talking to you!,
It’ll draw them here and they’ll drag us into the mines as well!,It’ll draw them here and they’ll drag us into the mines as well!,
We’re not coming out until it’s safe and that’s that!,We’re not coming out until it’s safe and that’s that!,
The man begins to slide shut the hatch in the door,The man begins to slide shut the hatch in the door,
I need more information!,I need more information!,
Ore mines,Ore mines,
It’s an older mine that the Company reclaimed,It’s an older mine that the Company reclaimed,
We were expanding the western tunnels when we broke into an older part of the cave,We were expanding the western tunnels when we broke into an older part of the cave,
That’s where we found the stairs,That’s where we found the stairs,
Stairs?,Stairs?,
"Listen, I don’t want to talk anymore about this right now","Listen, I don’t want to talk anymore about this right now",
"We found the stairs, Company sent their expedition up onto the plateau and whatever they found, things went to shit!","We found the stairs, Company sent their expedition up onto the plateau and whatever they found, things went to shit!",
Kill those things in the mine and I’ll be a lot more talkative,Kill those things in the mine and I’ll be a lot more talkative,
I'd best get going then,I'd best get going then,
"Well, be quick about it!","Well, be quick about it!",
They could be back any time!,They could be back any time!,
What's happened here?,What's happened here?,
Who are 'they'?,Who are 'they'?,
The hatch in the door slides open and a pair of haggard eyes stare out apprehensively,The hatch in the door slides open and a pair of haggard eyes stare out apprehensively,
You’re still alive?,"Still alive, are you?",
Is it safe to come out?,Is it safe to come out?,
Not yet but I need to talk!,"Not yet, but I need to talk!",
#MineExit,#MineExit,
You stand at the foot of the stairs for a moment,You stand at the foot of the stairs for a moment,
It’s as if something is holding you back,It’s as if something is holding you back,
"If you take even the first step, events will be set in motion that can never be undone","If you take even the first step, events will be set in motion that can never be undone",
Then the strangest thought strikes you,Then the strangest thought strikes you,
You’ve always been climbing these stairs and you will keep climbing them until the universe ends,You’ve always been climbing these stairs and you will keep climbing them until the universe ends,
Take the first step,Take the first step,
The morbid thought is soon dispelled by the endless monotony of the climb,The morbid thought is soon dispelled by the endless monotony of the climb,
The shaft goes straight forwards and up at a steep angle,The shaft goes straight forwards and up at a steep angle,
There is no bend or curve,There is no bend or curve,
Just the same infinitely ascending stairs perfectly carved through the heart of the mountain,Just the same infinitely ascending stairs perfectly carved through the heart of the mountain,
"For the longest time, the only change is the drop in temperature as you get higher","For the longest time, the only change is the drop in temperature as you get higher",
"Then, finally you catch the first glimpse of natural light in a long time","Then, finally you catch the first glimpse of natural light in a long time",
The exit is in sight!,The exit is in sight!,
The exhilaration fills you with energy and rejuvenates your aching thighs,The exhilaration fills you with energy and rejuvenates your aching thighs,
"With a final exertion, you make it to the top and emerge onto the barren plains of the interior plateau","With a final exertion, you make it to the top and emerge onto the barren plains of the interior plateau",
The Black Priory awaits you,The Black Priory awaits you,
#MineFaultyBeam,#MineFaultyBeam,
The support-beam appears to be close to giving in,The support beam appears to be close to giving in,
"It seems that if this beam breaks, this whole section of tunnel will collapse","It seems that if this beam breaks, this whole section of tunnel will collapse in on itself",
"If you have some rope, you might be able to take advantage of this to rig a trap of sorts","If you have some rope, you might be able to take advantage of this to rig a trap of sorts",
Use rope to rig trap,Use rope to rig trap,
A makeshift trap,A makeshift trap,
"If you had a reason to do so, you could cause this section of tunnel to collapse - crushing anyone inside under tons of rock","If you had a reason to do so, you could cause this section of tunnel to collapse - crushing anyone inside under tons of rock",
"You carefully tie the rope around the beam in such a way that if you give it a good tug, the beam will cause the tunnel ahead to collapse","You carefully tie the rope around the beam in such a way that if you give it a swift, hard tug, the beam will cause the tunnel ahead to collapse",
#MineSecretDoor,#MineSecretDoor,
This section of wall appears to be close to collapsing,This section of wall appears to be close to collapsing,
If you have a pick-axe you could likely break through to the other side,If you have a pickaxe you could likely break through to the other side,
Use pick-axe!,Use pickaxe!,
You make short work of the wall and in no time it collapses to reveal that you have just linked up to the mine entrance,You make short work of the wall and in no time it collapses to reveal that you have just linked up to the mine entrance,
This will no doubt serve as a handy short-cut should you have the need to return to Adler’s Helm,This will no doubt serve as a handy short-cut should you have the need to return to Adler’s Helm,
#,#,
# Chapter_4_Embla,# Chapter_4_Embla,
#,#,
#EmblaExplains1,#EmblaExplains2,
Heresy,Heresy,
There are powerful men who would burn us alive at the very mention of it,There are powerful men who would burn us alive at the very mention of it,
"They have known about it for a long time, the courts of the Magi","They have known about it for a long time, the courts of the Magi",
It is the nightmare they want to close their eyes and pretend doesn’t exist,It is the nightmare they want to close their eyes from and pretend doesn’t exist,
Not here,Not here,
We’ve already lingered for too long and I've said too much,We’ve already lingered for too long and I've said too much,
We better move on for now and talk more once we leave Idra behind,We better move on for now and talk more once we leave Idra behind,
"As mankind has ever ruled the land, there are far older and more sinister things that rule the depths of the ocean","As mankind has ever ruled the land, there are far older and more sinister things that rule the depths of the ocean",
Ancient things with utterly alien minds,Ancient things with utterly alien minds,
"The Deep-Ones are drawn here, like flies to carrion, and now they too have their terrible eyes fixed on Gradla","The Deep Ones are drawn here, like flies to carrion, and now they too have their terrible eyes fixed on Gradla",
Is that why the Reavers were sending people to Gradla?,Is that why the Reavers were sending people to Gradla?,
The Reavers serve the gods that their ancestors worshiped here in the Outer Isles,The Reavers serve the gods that their ancestors worshiped here in the Outer Isles,
A faith that had lain dormant for millennia,A faith that had lain dormant for millennia,
"As the conjunction approached, they were reminded of old allegiances and old, terrible ways","As the conjunction approached, they were reminded of old allegiances and old, terrible ways",
Conjunction?,Conjunction?,
What does that mean?,What does that mean?,
Embla smiles,Embla smiles,
I promise there will be time for more questions once we are safe,I promise there will be time for more questions once we are safe,
"For now, I’m truly happy it’s you by my side here at the edge of madness","For now, I’m truly happy it’s you by my side here at the edge of madness",
"Now, let’s finish gathering supplies and then make our way to Iago","Now, let’s finish gathering supplies and then make our way to Iago",
"Time unfortunately, is working against us","Time unfortunately, is working against us",
"Now, we must make haste in finding a ship and crew to bear us to Gradla",Now we must make haste in finding a ship and crew to bear us to Gradla,
And you ventured forth,And you ventured forth,
Lord Cato offered me a substantial amount of money to rescue you,Lord Cato offered me a substantial sum to rescue you,
That is all,That is all,
"You know as well as I, my family has a debt of honor to yours","You know as well as I, my family has a debt of honour to yours",
I’ve known you since we were small children,I’ve known you since we were small children,
How could I not come?,How could I not come?,
"I’m sure that if we make it back, my dear father will indeed drown you in gold","I’m sure that if we make it back, my dear father will indeed drown you in gold",
"For now, some answers will do!","For now, some answers will do!",
Embla’s face becomes severe,Embla’s face becomes severe,
"Your family is tied to mine but believe me when I say, it is not by duty","Your family is tied to mine but believe me when I say, it is not by duty",
There are forces at work here that I’m only beginning to understand,There are forces at work here that I’m only just beginning to understand,
You have to give me something!,You have to give me something!,
I appreciate that old friend,"I appreciate that, old friend",
"Nonetheless, I would say we are always going to end up standing here","Nonetheless, I would say we are always going to end up standing here",
We have before and we will again,We have before and we will again,
There you go again!,There you go again!,
What does that even mean?,What does that even mean?,
I need some answers,I need some answers,
"Unceremoniously, Embla sets off at a brisk pace","Unceremoniously, Embla briskly sets off; drawn to her fate",
We should venture to be as well prepared as possible before leaving Idra,We should venture to be as well prepared as possible before leaving Idra,
"Any supplies we need, now is the time to get them","Any supplies we need, now is the time to get them",
A bizarre thought crosses your mind,A bizarre thought crosses your mind,
It’s like she’s an actor playing out a scene she’s performed a hundred times before,It’s like she’s an actor playing out a scene she’s performed a hundred times before,
We need to put all our effort into finding a captain that will take us off the island,We need to put all our effort into finding a captain that will take us off the island,
Markus talked about the sea-cave on the island’s north-western coastline,Markus talked about the sea cave on the island’s northwestern coastline,
"What, no 'thank-you'?","What, no 'thank you'?",
"Embla, stop!","Embla, stop!",
I'm not leaving until I get some answers,I'm not leaving until I get some answers,
And we have much to talk about,And we have much to talk about,
Though I may have fewer answers than you would have preferred,Though I may have fewer answers than you would have preferred,
"Worse yet, I fear what answers I do have, you will wish you had never gotten","Worse yet, I fear what answers I do have, you will wish you had never gotten",
Embla looks around,Embla looks around,
Her voice drops,Her voice drops,
"Sadly, we are much less safe here in Horryn than Markus would like to believe","Sadly, we are much less safe here in Horryn than Markus would like to believe",
I’ll answer what I can now but most things should wait until we are far away from here,I’ll answer what I can now but most things should wait until we are far away from here,
Are you still afraid of the Reavers?,Are you still afraid of the Reavers?,
Them least of all,Them least of all,
But there are other forces far older and more powerful than the Reavers with their eyes fixed on the Outer Isles,There are other forces far older and more powerful than the Reavers with their eyes fixed on the Outer Isles,
Let’s just be careful,Let’s just be careful,
Embla turns around and blinks,Embla turns around and blinks,
For a moment it’s almost as if she’s seeing you for the first time,For a moment it’s almost as if she’s seeing you for the first time,
My mind is a bit scattered these days,My mind is a bit scattered these days,
Your resourcefulness in finding me never ceases to amaze me,Your resourcefulness in finding me never ceases to amaze me,
Then again it’s always been that way,Then again it’s always been that way,
She offers a tired smile,She offers a tired smile,
Day-dreamer,Daydreamer,
Star-Child,Star Child,
I’ve no time for sentimental dribble!,I’ve no time for sentimental dribble!,
I want answers!,I want answers!,
Lord Cato summoned me,Lord Cato summoned me,
Told me you were missing,Told me you were missing,
Without you I would be left in the darkness of the keep to suffer an infinite number of gruesome fates,Without you I would be left in the darkness of the keep to suffer an infinite number of equally gruesome fates,
Over and over,Over and over,
You’re the only one who can find me and drag me back into the light,You’re the only one who can find me and drag me back into the light,
It has to be you - and for that I am glad… ‘Day-Dreamer’,It has to be you - and for that I am glad… ‘Daydreamer’,
I don’t understand! ‘Infinite’?,I don’t understand! ‘Infinite’?,
Reality itself is becoming undone around us,Reality itself is becoming undone around us,
We cannot escape it so instead we must seek the eye of the storm,We cannot escape it so instead we must seek the eye of the storm,
There is something there that beckons,There is something there that beckons,
Embla interrupts herself and looks around suspiciously,Embla interrupts herself and looks around suspiciously,
And that 'Father' thing?,And that 'Father' thing?,
Terror stalks the seas around Idra and I suspect you have seen it as well,Terror stalks the seas around Idra and I suspect you have seen it as well,
I believe a fast ship and a skilled captain can allow us to move around within the Outer Isles but there is no way for us to brave the high seas and reach the mainland,I believe a fast ship and a skilled captain can allow us to move around within the Outer Isles but there is no way for us to brave the high seas and reach the mainland,
What’s more,What’s more,
Embla looks towards the sky,Embla looks towards the sky,
Stars aren’t right,The stars aren’t right,
Embla mumbles almost to herself,Embla mumbles almost to herself,
I’m not even sure it would be possible to reach,I’m not even sure it would be possible to reach,
She shakes her head as if clearing out unwelcome thoughts,She shakes her head as if clearing out unwelcome thoughts,
The point is moot,The point is moot,
We must reach Gradla or perish trying,We must reach Gradla or perish trying,
What is happening here?,What is happening here?,
I don't understand it!,I don't understand it!,
Then let's get going,Then let's get going,
"So, ask what you will but mind your surroundings","So, ask what you will - but mind your surroundings",
What’s really going on here Embla?,"What’s really going on here, Embla?",
