original,translate,
"Blood sprays from the Butcher’s mouth as he strains from the effort and with a wet, sickening snap, Kala’s arm is torn from her body","Blood sprays from the Butcher’s mouth as he strains from the effort and with a wet, sickening snap, Kala’s arm is torn from her body",
They both collapse - dead,They both collapse - dead,
Suddenly all is quiet,Suddenly all is quiet,
You’ve defeated the three Reaver chieftains,You’ve defeated the three Reaver chieftains,
Now Father awaits,Now Father awaits,
You?!,You?!,
Out with it!,Out with it!,
Her eyes narrow,Her eyes narrow,
Yes!,Yes!,
I sense it!,I sense it!,
There is blood in the water and soon there will be blood in the streets!,There is blood in the water and soon there will be blood in the streets!,
Finally we will be done with this petty bickering and Father will let us join him in the keep!,Finally we will be done with this petty bickering and Father will let us join him in the keep!,
The Butcher wants you to join him in stamping out Oleg,The Butcher wants you to join him in stamping out Oleg,
Oleg asks you to join him against the Butcher!,Oleg asks you to join him against the Butcher!,
#HorrynReaverChief3,#HorrynReaverChief4,
I’ll drink your marrow and tear your flesh!!!,I'll tear flesh from bone and drink your marrow within!!!,
Give them to me!,Give them to me!,
His meaty hands tremble with excitement as he greedily takes the tablets from you,His meaty hands tremble with excitement as he greedily takes the tablets from you,
"Mesmerized, he traces the grotesque carvings with fat, blood-smeared fingers","Mesmerised, he traces the grotesque carvings with fat, blood-smeared fingers",
I hear you!,I hear you!,
Your will shall be done!,Your will shall be done!,
"The assembled reavers gather around and begin a low, droning chant","The assembled reavers gather around and begin a low, droning chant",
He looks up at you with black eyes,He looks up at you with black eyes,
My ascent to Father’s side begins!,My ascent to Father’s side begins!,
Soon I’ll join him in the keep,Soon I’ll join him in the keep,
All that is left is the sacrifice of the firstborn,All that is left is the sacrifice of the firstborn,
Go to Kala!,Go to Kala!,
Tell her she will be at my side and together we’ll make an offering of Oleg and his pathetic little band!,Tell her she will be at my side and together we’ll make an offering of Oleg and his pathetic little band!,
Tell her this is a knife night!,Tell her this is a knife night!,
A red night!,A red night!,
Now go!,Now go!,
We must make ready!,We must make ready!,
"A beast of a man, bald and covered in crude sailor’s tattoos stands wide legged on the stairs of the desecrated temple","A beast of a man, bald and covered in crude sailor’s tattoos stands wide legged on the stairs of the desecrated temple",
You come to the Butcher willingly?,You come to the Butcher willingly?,
Like some lamb crawling into the mouth of a wolf?,Like some lamb crawling into the mouth of a wolf?,
Perhaps there is something about you?,Perhaps there is something about you?,
Tell me,Tell me,
Why are you here?,Why are you here?,
Oleg sent me to remind you that as long as he holds the Whispering Tablets you owe him allegiance,Oleg sent me to remind you that as long as he holds the Whispering Tablets you owe him allegiance,
I am the butcher of the weak,I am the butcher of the weak,
It has fallen to me to cull those that are too feeble to join Father in the keep,It has fallen to me to cull those that are too feeble to join Father in the keep,
With cleaver and fire I do his bidding like an obedient son,"With cleaver and fire I do his bidding, like an obedient son",
Or dog,Or dog,
But he’ll call upon me soon enough and I’ll be at his side doing the holy work inside the keep!,But he’ll call upon me soon enough and I’ll be at his side doing the holy work inside the keep!,
The Butcher’s eyes flicker to the tall walls of the keep to the south,The Butcher’s eyes flicker to the tall walls of the keep to the south,
I just have to bring my upstart siblings in line first,I just have to bring my upstart siblings in line first,
Father hates bickering,Father hates bickering,
How do you intend to do that?,How do you intend to do that?,
Kala and Oleg,Kala and Oleg,
He spits in disgust,He spits in disgust,
Kala is fierce,Kala is fierce,
Caught many of the weak and gave me the ones Father could not use,Caught many of the weak and gave me the ones Father could not use,
I’ll not soon forget that,I’ll not soon forget that,
Her sin now is idleness,Her sin now is idleness,
She and her brood sit there in their rat hole on the docks bored and stewing,She and her brood sit there in their rat hole on the docks bored and stewing,
I’ll deal with her in time,I’ll deal with her in time,
Oleg is first,Oleg is first,
What of him?,What of him?,
He’s the oldest of us - and the weakest,He’s the oldest of us - and the weakest,
However he was also the one to drag the Whispering Tablets from the seas,However he was also the one to drag the Whispering Tablets from the seas,
Came up in his nets when he was fishing and he was the first to hear the word from the Deep,Came up in his nets when he was fishing and he was the first to hear the word from the Deep,
He may have had his role to play but it’s over for him now,"He may have had his role to play, but it’s over for him now",
It’s time the tablets came to their rightful owner,It’s time the tablets came to their rightful owner,
It’s time they came to me,It’s time they came to me,
And all the rest of the brethren will flock to me and Father will see I’m the one deserving of his love,And all the rest of the brethren will flock to me and Father will see I’m the one deserving of his love,
Not that gray fool!,Not that grey fool!,
The Butcher’s eyes narrow predatorily,The Butcher’s eyes narrow predatorily,
What are you thinking?,What are you thinking?,
The man’s laughter booms throughout the plaza,The man’s laughter booms throughout the plaza,
Is that what he said?,Is that what he said?,
That decrepit old fool is owed nothing except my axe through his head,That decrepit old fool is owed nothing except my axe through his head,
Father favors me and me alone and that piss-stinking old man shall be my offering to him,Father favours me and me alone and that piss-stinking old man shall be my offering to him,
But I’ll give him this,But I’ll give him this,
The Whispering Tablets do indeed hold the word from the Deep,The Whispering Tablets do indeed hold the word from the Deep,
The brethren will flock to whomever possesses them,The brethren will flock to whomever possesses them,
And Father’s favor will follow,And Father’s favour will follow,
You may have a role to play in this yet,You may have a role to play in this yet,
I see it in your face - around your eyes,I see it in your face - around your eyes,
Seek out the Whispering Tablets,Seek out the Whispering Tablets,
Oleg hoards them well but I know where,"Oleg hoards them well, but I know where",
There are tunnels under his lodge,There are tunnels under his lodge,
Deep tunnels,Deep tunnels,
A canny cutter like you would do well in looking for the hidden entrance,A canny cutter like you would do well in looking for the hidden entrance,
That is if you don’t mind wading through more shit,That is if you don’t mind wading through yet more shit,
Could you be more clear?,Could you be more clear?,
I already have the tablets!,I already have the tablets!,
I've had enough of you madmen!,I've had enough of you madmen!,
You’ll find a way,You’ll find a way,
I smell it on you,I smell it on you,
Go now!,Go now!,
Find the tablets and bring them to me - Quick and quiet,Find the tablets and bring them to me - quick and quiet,
There will be plenty bloodshed but I will be the one spilling the blood once the tablets are safe in my hands,There will be plenty bloodshed but I will be the one spilling the blood once the tablets are safe in my hands,
"Now, begone!","Now, begone!",
Have you talked to Kala?!,Have you talked to Kala?!,
You must go to her!!,You must go to her!!,
Talk!,Talk!,
I have the tablets!,I have the tablets!,
#HorrynSpiral1,#HorrynSpiral2,
As you try to leave crabs swarm past you,"As you try to leave, crabs swarm past you",
They consume the strange symbol ravenously,They consume the strange symbol ravenously,
They leave,They leave,
"Entering what appears to be a fishmongers' hall, your noses are immediately assaulted by a putrid stench far beyond the expected nautical aromas","Entering what appears to be a fishmongers' hall, your noses are immediately assaulted by a putrid stench far beyond the expected nautical aromas",
"The room is but dimly lit, and as shadows dance in the corners it becomes apparent that the floor in front of you is covered in parts and innards from fish and other creatures of the sea","The room is but dimly lit, and as shadows dance in the corners it becomes apparent that the floor in front of you is covered in parts and innards from fish and other creatures of the sea",
"As your eyes slowly adjust, you discern that the heaps of fetid offal have been carefully arranged into a peculiar shape","As your eyes slowly adjust, you discern that the heaps of fetid offal have been carefully arranged into a peculiar shape",
Examine the shape more closely,Examine the shape more closely,
"Retching and gagging, you immediately leave","Retching and gagging, you immediately leave",
YOU PICK UP THE ITEM,YOU PICK UP THE ITEM,
"However, the clacking noises have become louder and more insistent","However, the clacking noises have become louder and more insistent",
"The slick, gleaming carapaces of enormous crabs suddenly flood the room","The slick, gleaming carapaces of enormous crabs suddenly flood the room",
No doubt drawn in by the smell,No doubt drawn in by the smell,
OR SOMETHING ELSE,OR SOMETHING ELSE,
Prepare for combat!,Prepare for combat!,
"Striving to avoid slipping on the blood-slicked floor, you fully enter the hall and investigate the overall shape of the piles of fish guts with a discerning eye","Striving to avoid slipping on the blood-slicked floor, you fully enter the hall and investigate the overall shape of the piles of fish guts with a discerning eye",
The parts are clearly arranged into a massive spiral - an ancient symbol of fertility and the sea,The parts are clearly arranged into a massive spiral - an ancient symbol of fertility and the sea,
"At the center of the spiral sits a particularily bloated and decayed octopus, its arms splayed outwards in all directions","At the center of the spiral sits a particularly bloated and decayed octopus, its arms splayed outwards in all directions",
You can hear faint clacking,You can hear faint clacking,
Something seems to be moving nearby,Something seems to be moving nearby,
Further examine the octopus,Further examine the octopus,
"Leave, quickly","Leave, quickly",
"Like a monstrous egg, the swollen and very dead octopus sits at the center of the disgusting spiral","Like a monstrous egg, the swollen and very dead octopus sits at the center of the disgusting spiral",
"A swift kick upends it, revealing something beneath: a large, rusty key!","A swift kick upends it, revealing something beneath: a large, rusty key!",
Pick up the key,Pick up the key,
"Striving to avoid slipping on the blood-slicked floor, you fully enter the hall and investigate the overall shape of the piles of fish guts","Striving to avoid slipping on the blood-slicked floor, you fully enter the hall and investigate the overall shape of the piles of fish guts",
"After a few moments it strikes you - they are arranged, obviously with great care and effort, into a massive spiral","After a few moments it strikes you - they are arranged, obviously with great care and effort, into a massive spiral",
"Why, you have no idea","Why, you have no idea",
#HorrynSurvivorCora,#HorrynSurvivorCora,
You cautiously begin to search for any potential hiding places but have no luck,"You cautiously begin to search for any potential hiding places, but have no luck",
"Kat sighs, her expression troubled “What a shame","Kat sighs, her expression troubled “What a shame",x
She looked like she could have used our help,She looked like she could have used our help,
Give up and leave,Give up and leave,
You cautiously begin to search for any potential hiding places,You cautiously begin to search for any potential hiding places,
The girl must be here somewhere,The girl must be here somewhere,
You startle as a cry of pain echoes behind you,You startle as a cry of pain echoes behind you,
You little shit!,You little shit!,
"Roland shouts, clutching his hand to his chest as he backs away from a pile of trash","Roland shouts, clutching his hand to his chest as he backs away from a pile of refuse",
"The girl darts out a second later, trying to slip between you","The girl darts out a second later, trying to slip between you",
Kat throws herself at the girl and grabs hold of her before she can escape,Kat throws herself at the girl and grabs hold of her before she can escape,
"Determined not to be outmaneuvered again, you grab hold of the girl’s arm before she can make her escape","Determined not to be outmaneuvered again, you grab hold of the girl’s arm before she can make her escape",
Sharp teeth dig into the flesh of your hand as you reach into a pile of rags,Sharp teeth dig into the flesh of your hand as you reach into a pile of rags,
"The girl dashes from her hiding place, trying to slip away again","The girl dashes from her hiding place, trying to slip away again",
"The girl struggles against your grip, snarling at you as you attempt to speak with her","The girl struggles against your grip, snarling at you as you attempt to speak with her",
"She can be no older than 13 winters, but her emaciated frame and grime-covered skin make it hard to tell","She can be no older than 13 winters, but her emaciated frame and grime-covered skin makes it hard to tell",
"The girl glares up at Kat with wide, scared eyes","The girl glares up at Kat with wide, scared eyes",
"Poor thing,","Poor thing,",
"Kat says, patting her arm, “you must be starving","Kat says, patting her arm, “you must be starving",
Are you hungry?,Are you hungry?,
offer some food,offer some food,
I don't think I can help you right now,I don't think I can help you right now,
"You give chase through the narrow alleyways, scrambling to keep up with the agile girl, but she is too fast; she disappears into the shadows before you can catch up to her","You give chase through the narrow alleyways, scrambling to keep up with the agile girl, but she is too fast; she disappears into the shadows before you can catch up to her",
Search the alley,Search the alley,
Give up,Give up,
It doesn’t take long for you to catch up to the girl in the maze of back alleys,It doesn’t take long for you to catch up to the girl in the maze of back alleys,
"Cornered, she glares at you, her lips curling in a feral snarl","Cornered, she glares at you, her lips curling in a feral snarl",
Don’t harm her!,Don’t harm her!,
Kat whispers as she moves towards the girl slowly with her hands up in front of her in a disarming gesture,Kat whispers as she moves towards the girl slowly with her hands up in front of her in a disarming gesture,
"As you pass the darkened alley, you feel the eyes of someone watching you","As you pass the darkened alley, you feel the eyes of someone watching you",
"Peering into the shadows, you can just make out the form of what appears to be a little girl in dirty, torn clothing","Peering into the shadows, you can just make out the form of what appears to be a little girl in dirty, torn clothing",
"Before you can get a closer look, the girl flees, disappearing into the darkness beyond","Before you can get a closer look, the girl flees, disappearing into the darkness beyond",
Kat grabs your cloak,Kat grabs your cloak,
We have to follow her!,We have to follow her!,
Ignore it and move on,Ignore it and move on,
The girl seems unwilling to talk,The girl seems unwilling to talk,
Perhaps if she had some food in her belly?,Perhaps if she had some food in her belly?,
"You look around the alley, ears straining for any sign of reavers nearby","You look around the alley, ears straining for any sign of Reavers nearby",
"The thought of leaving the girl behind is not a comfortable one, but it is wiser than trying to drag her through hostile territory","The thought of leaving the girl behind is not a comfortable one, but it is wiser than trying to drag her through hostile territory",
"For now, she is as safe as she can be","For now, she is as safe as she can be",
"Once the Reavers started fighting amongst themselves, they blocked off the streets","Once the Reavers started fighting amongst themselves, they blocked off the streets",
"Made it real hard to get around unseen, but I'm no fool","Made it real hard to get around unseen, but I'm no dunderhead",
Cora smiles mischievously,Cora smiles mischievously,
I suspect not,I suspect not,
She seems pleased at the compliment,She seems pleased at the compliment,
"It's too dangerous and hard to travel the streets, but under them is another thing","It's too dangerous and hard to travel the streets, but under them is another thing",
"There’s tunnels all under the city and if you don't mind the stench and avoid the beasties, they’ll take you wherever you need to go!","There’s tunnels all under the city, and if you don't mind the stench and avoid the beasties, they’ll take you wherever you need to go!",
Clever girl,Clever girl,
"The girl still seems hesitant as she looks up at you. “....Cora,","The girl still seems hesitant as she looks up at you. “....Cora,",
"she says, her voice low","she says, her voice low",
"But I hate it, so everybody calls me Cory. ‘Cept my ma, that is","But I hate it, so everybody calls me Cory. ‘Cept my ma, that is",
And where's she now?,And where's she now?,
As soon as the question leaves your lips you realize the mistake,As soon as the question leaves your lips you realise the mistake,
You don’t push for the answer and Cora does not offer one: the silence says everything,You don’t push for the answer and Cora does not offer one: the silence does all the talking,
Kat gently strokes the child’s hair,Kat gently strokes the child’s hair,
The girl snatches the food from you like a frightened animal and wolfs it down,The girl snatches the food from you like a frightened animal and wolfs it down,
More!,More!,
she growls,she growls,
"Ah, so the girl has a tongue after all!","Ah, so the girl has a tongue after all!",
"Kat offers the girl a small, reassuring smile","Kat offers the girl a small, reassuring smile",
"Don’t worry, girl","Don’t worry, girl",
You can have as much as you like,You can have as much as you like,
Are you ready to answer some questions?,Are you ready to answer some questions?,
"The girl absentmindedly fiddles with something, but her eyes are sharp and watchful","The girl absentmindedly fiddles with something, but her eyes are sharp and watchful",
No doubt she knows a lot about the town having survived here for so long,"No doubt she knows a lot about the town, having survived here for so long",
What's your name?,What's your name?,
Tell me about the Reavers?,Tell me about the Reavers?,
How have you been moving around?,How have you been moving around?,
"The girl looks up at you with large, tear-filled eyes","The girl looks up at you with large, tear-filled eyes",
They mostly come out at night,They mostly come out at night,
Mostly,Mostly,
she hugs her arms around herself,she hugs her arms around herself,
At least... they used ta,At least... they used ta,
I don’t see ‘em as much anymore,I don’t see ‘em as much anymore,
Not since they started fightin’ each other,Not since they started fightin’ each other,
Fighting each other?,Fighting each other?,
"She nods, her gaze distant","She nods, her gaze distant",
One day they just turned on each other,One day they just turned on each other,
"Started killin’ their own instead of huntin’ people….now, though, they seem to be holed up in different parts of the town","Started killin’ their own instead of huntin’ people… now, though, they seem to be holed up in different parts of the town",
Almost as if…as if they’re waitin’ for somethin’,Almost as if… as if they’re waitin’ for somethin’,
One group seems to stay on the docks,One group seems to stay on the docks,
They’re led by a woman named Kala I think,They’re led by a woman named Kala I think,
"I saw ‘er, once","I saw ‘er, once",
Never knew women could look so cruel,Never knew women could look so cruel,
"she pauses, worrying at her lower lip","she pauses, worrying at her lower lip",
"Beside’ them, there’s another band holed up in that old walled house over there - ” she points to the north-east","Beside’ them, there’s another band holed up in that old walled house over there - ” she points to the north-east",
A gray-haired man called Oleg leads them,A grey-haired man called Oleg leads them,
Are there more?,Are there more?,
"There are men outside the temple, led by someone they call ‘the Butcher’","There are men outside the temple, led by someone they call ‘the Butcher’",
They…they’ve been doing horrible things,They… they’ve been doing horrible things,
Burning,Burning,
she trails off before shaking her head,she trails off before shaking her head,
"They’ve blocked off the streets leading to the temple, so those men don’t come to this part of the city anymore","They’ve blocked off the streets leading to the temple, so those men don’t come to this part of the city anymore",
Cora offers you a slight smile,Cora offers you a slight smile,
Her cheeks have regained a modcium of colour; it seems getting some food in her belly seems to have done her a world of good,Her cheeks have regained a modcium of colour; it seems getting some food in her belly seems to have done her a world of good,
I have some questions for you!,I have some questions for you!,
"Cora is huddled in the corner, her stick-thin arms wrapped around her knees","Cora is huddled in the corner, her stick-thin arms wrapped around her knees",
She slinks further into the shadows at the sight of you,She slinks further into the shadows at the sight of you,
Offer some food,Offer some food,
#HorrynSurvivorNatia,#HorrynSurvivorNatia,
Natia is pale and drawn,Natia is pale and drawn,
She must have lost a lot of blood,She must have lost a lot of blood,
"However, her wound is securely bound and she is in relative safety","However, her wound is securely bound and she is in relative safety",
"If it is within her to recover, she will","If it is within her to recover, she will",
Do you think you could answer some questions for me?,Do you think you could answer some questions for me?,
I'll help you as best I can,I'll help you as best I can,
What can you tell me of the men who took you?,What can you tell me of the men who took you?,
It's time to go!,It's time to go!,
Farewell!,Farewell!,
Natia looks tired and pale but nonetheless in much better shape than when you first met her,Natia looks tired and pale but nonetheless in much better shape than when you first met her,
She offers a weak smile as a greeting,She offers a weak smile as a greeting,
I had some questions for you!,I had some questions for you!,
I just wanted to check in on you!,I just wanted to check in on you!,
I did hear something!,I did hear something!,
The man who stabbed me was taking us to the keep - to ‘meet Father’,The man who stabbed me was taking us to the keep - to ‘meet Father’,
But he was angry that the Reavers in the city itself had taken to infighting,But he was angry that the Reavers in the city itself had taken to infighting,
Split up into groups they had,Split up into groups they had,
Fighting over ‘tablets’ or some such items he said,Fighting over ‘tablets’ or some such items he said,
"And what’s more, I heard him say that the tablets were currently in the possession of a Reaver he called Oleg","And what’s more, I heard him say that the tablets were currently in the possession of a Reaver he called Oleg",
Oleg the Gray or something to that effect,"Oleg the Grey, or something to that effect",
Thank you for your help,Thank you for your help,
#HorrynSurvivorPhilip,#HorrynSurvivorPhilip,
Thank you so much for saving Natia’s life,Thank you so much for saving Natia’s life,
I could not have gone on without her,I could not have gone on without her,
"Please, take this as a token of my gratitude!","Please, take this as a token of my gratitude!",
Philip produces a gold ring and offers it to you,Philip produces a gold ring and offers it to you,
Accept the ring,Accept the ring,
Keep it!,Keep it!,
Decline reward,Decline reward,
The man looks stunned for a moment then smiles and bows to you in gratitude,"The man looks stunned for a moment, then smiles and bows to you in gratitude",
You're a fool to turn down pay for a job well done,You're a fool to turn down pay for a job well done,
Roland grumbles behind you,Roland grumbles behind you,
I have some questions before we go,I have some questions before we go,
Farewell,Farewell,
Ask me anything you like and I'll help you if I can!,Ask me anything you like and I'll help you if I can!,
Will you be safe here?,Will you be safe here?,
Is there anything more you can tell me about the Reavers?,Is there anything more you can tell me about the Reavers?,
I need to get going,I need to get going,
